title,snippet,link,position,date
Groceries Beverages Juices Price - Daraz.pk,3300 items — Groceries Beverages Juices Price ; Just Fruit Mango Buddy 111ml - Fruit Drink. Rs. 216 ; Slice Mango Juice 1 Liter -Pack of 6. Rs. 560 ; Chaunsa Chaunsa ...,https://www.daraz.pk/groceries-beverages-juices/,0,2022-01-25 04:38:12
Buy Juice Drinks at Best Price in Nepal - Daraz,154 items — Juice Drinks. 154 items found in Juice Drinks. Real Mango Nectar 1L. Rs. 196. Rs. 245 -20%. (159). Nepal. Patanjali Amla Juice - 1 Ltr.,https://www.daraz.com.np/juices-non-carbonated-drinks/,1,2022-01-25 04:38:12
Buy Juice Drinks at Best Price in Bangladesh - Daraz,"1635 items — Juice Drinks Bangladesh - Shop for best Juice Drinks online at www.daraz.com.bd Wide Variety of Juices. Great Prices, Even Better Service.",https://www.daraz.com.bd/juices-non-carbonated-drinks/,2,2022-01-25 04:38:12
Fruit press juice machine online shopping daraz app best ...,,https://www.youtube.com/watch?v=2-4_YSfUH_I,3,2022-01-25 04:38:12
Umer daraz qaimkhani - Salesperson - MOVITA JUICE BAR,"View Umer daraz qaimkhani's profile on LinkedIn, the world's largest professional community. Umer daraz has 1 job listed ... Salesperson at MOVITA JUICE BAR.",https://pk.linkedin.com/in/umer-daraz-qaimkhani-60b5a7189,4,2022-01-25 04:38:12
DARAZ UAE - juicer extractor machine fruit juice squeezer...,"Jul 21, 2020 — juicer extractor machine fruit juice squeezer For more info cotact us 00971551569506 DR00076. ... DARAZ UAE, profile picture.What's keeping you fresh in the mornings after a long night of restful sleep? ➡️Some juice: https://click.daraz.com.np/e/_eBaxl OR ➡️Some coffee:...",https://www.facebook.com/101609631601550/posts/juicer-extractor-machine-fruit-juice-squeezerfor-more-info-cotact-us009715515695/135626848199828/,5,2022-01-25 04:38:12
DARAZ UAE - juicer extractor machine fruit juice squeezer...,"Jul 21, 2020 — juicer extractor machine fruit juice squeezer For more info cotact us 00971551569506 DR00076. ... DARAZ UAE, profile picture.",https://www.facebook.com/101609631601550/posts/juicer-extractor-machine-fruit-juice-squeezerfor-more-info-cotact-us009715515695/135626848199828/,6,2022-01-25 04:38:12
"Daraz Online Shopping, profile picture - Facebook",What's keeping you fresh in the mornings after a long night of restful sleep? ➡️Some juice: https://click.daraz.com.np/e/_eBaxl OR ➡️Some coffee:...,https://m.facebook.com/daraznp/photos/a.1886702411649881/2895441220775990/?type=3&eid=ARBeNZxIuK4oLy3w82cLMfo1cpkTaugexKEb6tlg9K9oxwby22ihaRFuU4KYQgPn300sUTYRafwd_iql,7,2022-01-25 04:38:12
"Daraz apologizes for the 'drone incident', refunds the customer ...","Oct 6, 2020 — daraz-techjuice. 0share; Facebook; Twitter; LinkedIn · WhatsApp · Gmail. Daraz has been making waves for all the wrong reasons over the past ...",https://www.techjuice.pk/daraz-apologizes-for-the-drone-incident-refunds-the-customer-and-delists-the-seller/,8,2022-01-25 04:38:12
Slice Juice Price in Pakistan - Price Updated Jan 2022,"Dec 9, 2021 — The Lowest price of Slice Juice in Pakistan is Rs.25 and ... The Slice Juice is one of the fruit-flavoured soft drinks ... daraz.pk.",https://shopsy.pk/slice-juice,9,2022-01-25 04:38:12
Daraz-Shop-TechJuice-1280x720 - Profit by Pakistan Today,"Dec 31, 2021 — Daraz-Shop-TechJuice-1280×720. Whatsapp Newsletter · Email Newsletter News Tips · Profit by Pakistan Today. Publishing Editor: Babar Nizami ...",https://profit.pakistantoday.com.pk/2021/12/31/digital-payments-account-for-over-50pc-of-sales-on-daraz-ceo-bjarke/daraz-shop-techjuice-1280x720/,10,2022-01-25 04:38:12
Nasty Juice E-liquid for sale online in Pakistan by VapeStation,Nasty Juice is a Malaysian e-liquid company that has reached worldwide fame with their range of exotic and fruity juice flavoured e-liquids.,https://vapestation.pk/product-category/eliquids-ejuices-pakistan/nasty-juice-eliquids-online-in-pakistan/,11,2022-01-25 04:38:12
Pilot Study of the Tart Cherry Juice for the Treatment ... - PubMed,"by JN Losso · 2018 · Cited by 39 — Cherry juice increased sleep time and sleep efficiency. Cherry juice procyanidin B-2 inhibited IDO, increased tryptophan availability, reduced inflammation, ...",https://pubmed.ncbi.nlm.nih.gov/28901958/,12,2022-01-25 04:38:12
Empty gift basket daraz. A thoughtful gift for a man who travels ...,"1186 items — Everything you expect from a juicer – high juice extraction, cleaning within 1 min – in a compact design that is half the size ! *.",http://patagonicapropiedades.com/lae7y3/empty-gift-basket-daraz.html,13,2022-01-25 04:38:12
Daraz Online Shopping App - Apps on Google Play,"Welcome to Daraz Online Shopping App!. With up to 4 million daily users, you're in very good company. Daraz is the leading online marketplace in ...",https://play.google.com/store/apps/details?id=com.daraz.android&hl=en_US&gl=US,14,2022-01-25 04:38:12
Pubg material buy online. Go and buy yours now!! Mobile ...,5W vivo FlashCharge technology to re-juice quicker than ever. ... 10% Extra Bank Discount on PUBG Mobile – 60 UC (Unknown Cash) at Daraz.,https://tokyomarunouchipartnership.com/qqhvb/pubg-material-buy-online.html,15,2022-01-25 04:38:12
"Fx sale in kpk. Suzuki Cars in Pakistan, … is video me fx ...","Products 1 - 32 of 412 — ... cheap & salt e juice liquid, accessories sale online, ... Search the newest mobile phone at the lowest prices on Daraz Pakistan ...",http://thedermatologyhouse.com/lmipczq/fx-sale-in-kpk.html,16,2022-01-25 04:38:12
Online shopping in Nepal | Buy online in Nepal | Online store ...,"The biggest online shopping store in Nepal.Buy/shop cross-boarder products from Flipkart and Myntra,men,women,kids clothes,watches,shoes,electronics,apparel ...",https://www.sastodeal.com/,17,2022-01-25 04:38:12
Naheed.pk - Online Shopping in Pakistan: Cosmetics ...,"Secure online shopping in Pakistan. Shop online at Pakistan's most trusted online shopping store. Buy Makeup, Grocery, Health & Beauty Products, Mobiles, ...",https://www.naheed.pk/,18,2022-01-25 04:38:12
Power full energy drink price in pakistan. It is filled with 27 ...,"3361 results — ... Sports and Energy Drinks, Enhanced Water, Juice, Tea, Coffee, and More! ... from the most trusted online stores in Pakistan such as daraz.",https://athmsi.org/dclbvzh/power-full-energy-drink-price-in-pakistan.html,19,2022-01-25 04:38:12
Online books delivery lahore. The best place to buy books ...,"1 Small Pizza, Cappy Orange Juice & a FREE Oxford Book. com, one of the best online books ... TCS has additionally consented to an arrangement with Daraz.",http://kufuorfoundation.org/jxn7nx/online-books-delivery-lahore.html,20,2022-01-25 04:38:12
"Bicycle shops in lahore. 3,033 likes · 2 talking about this ...","Visit Lahore shop on Daraz. ... Lahore mei qaim taza juice ki maroof tareen dukan Hafiz Juice, jisay dekh kar puray shehr mei logo ne issi naam se dukanei ...",http://sankalplaminates.com/nthlf9/bicycle-shops-in-lahore.html,21,2022-01-25 04:38:12
"Shwapno Online Grocery Shopping in Dhaka, Chattogram ...","Order grocery online, save money, save time.",https://www.shwapno.com/,22,2022-01-25 04:38:12
Vape pen price in pakistan. SMOK Nfinx-Mate 25W Pod ...,"Shop vape kits, mods & vape juice from all the best vape brands at vaping. ... Buy Luxury Pens Products in Pakistan at Discounted Prices Online with Daraz.",http://mennska.com/0ds1lz/vape-pen-price-in-pakistan.html,23,2022-01-25 04:38:12
Buy on installments in pakistan. To purchase mobile on ...,Results 1 - 20 of 57 — To purchase mobile on installment from Daraz pakistan. ... Whether you are pursuing brand-new eminent viewing to juice up your living ...,http://202106281336019883109.onamaeweb.jp/pszwe/buy-on-installments-in-pakistan.html,24,2022-01-25 04:38:12
"Infinix coin. Hardware. In most casinos, the house edge in ...",Daraz provides immediate and easy access to 50 million products in over 100 ... 2 (E311) Micromax Canvas Nitro (E455) Micromax Canvas Juice 3 Plus Micromax ...,http://rastreioonline.com.br/ubnpms1b/infinix-coin.html,25,2022-01-25 04:38:12
Cold war motorcycle skin. DGSE Mobility and Heavy Weapons ...,230 items — 100 Percent Orange Juice ElAmigos [Update 3. ... Extra Bank Discount on Call of Duty Cold War Themed Skin Sticker for XBOX 360 Phat Model at Daraz.,http://7new.com.br/of0h5/cold-war-motorcycle-skin.html,26,2022-01-25 04:38:12
Desi chicken for sale in karachi. Hens & Aseel Classified Ads ...,"5 Liter, Nestle Juice 1 Liter, Dates 250gms, Full Chicken Broast, ... Roll ₨ 160 ₨ 150 Imtiaz Super Market Imtiaz Price List Metro Daraz Chase-Up Burger Lab ...",http://vzcommunications.com/xhrxa6e/desi-chicken-for-sale-in-karachi.html,27,2022-01-25 04:38:12
Cold war motorcycle skin. 95 - $99. Black Ops Cold War ...,230 items — 100 Percent Orange Juice ElAmigos [Update 3. ... Extra Bank Discount on Call of Duty Cold War Themed Skin Sticker for XBOX 360 Phat Model at Daraz.,http://jtsmedicalcentre.com/njiioa/cold-war-motorcycle-skin.html,28,2022-01-25 04:38:12
Chinese atv headlights not working. By ROXANNERHIGDON ...,"Daraz is the leading online marketplace in South Asia, empowering tens of thousands of ... or only tries lazily to do so, your battery may be low on juice.",http://leeequities.com/tdhahl8/chinese-atv-headlights-not-working.html,29,2022-01-25 04:38:12
y20 pill blue. Here is the interesting part: he made it such that ...,"The phone is now available exclusive to Daraz Online Shopping. ... Heat the sugar, golden syrup and orange juice in a large pan over a low heat, ...",http://seberita.online/y20-pill-blue,30,2022-01-25 04:38:12
"Glass jars olx. HTTP/1.1 200 OK Date: Mon, 24 Jan 2022 14 ...","8 hours ago — ... Juice Bottle, Tea Bottle, Coffee Bottle, Tea Flask, Coffee Flask. 0 out of 5 stars 12. Product ID : R46. Daraz provides immediate and ...",https://irl51.kiev.ua/r094xcn/glass-jars-olx.html,31,2022-01-25 04:38:12
Famous muslim shrine in india. Free for commercial use High ...,"... olive oil, pepper, pickled carrot, garlic, lemon juice, and salt. ... as the birthplace of the Sufi saint, Hazrat Gesu Daraz (1320–1422), whose tomb, ...",http://volmaxsolucoes.com.br/5fzeoye5/famous-muslim-shrine-in-india.html,32,2022-01-25 04:38:12
Bbf restaurant. A restaurant chain is a set of related ...,Welcome to a new era of E-commerce where Daraz is an exciting new part of your daily life. ... Use a reamer or a lemon press to juice.,https://prettyview.ca/cheqr/bbf-restaurant.html,33,2022-01-25 04:38:12
Wood safe almari price in pakistan. Furniture Lahore 2 months ...,30 results — The prices of Wallpapers is collected from the most trusted online stores in Pakistan such as daraz. ... Banana leaf juice is an amazing cleanser.,http://katewatson.org/zcczal/wood-safe-almari-price-in-pakistan.html,34,2022-01-25 04:38:12
"s9 plus olx islamabad. 70,953 as of 25th December 2021 ...","This Samsung Galaxy S10 and Samsung S10+ Plus best price on Daraz Pakistan is ... Shop vape kits, mods & vape juice from all the best vape brands at vaping.",http://aurelijusweb.online/s9-plus-olx-islamabad,35,2022-01-25 04:38:12
"Ingco vs lotus. Shop the mobile app anytime, anywhere. 2000 ...","Daraz is the ultimate Nepali eCommerce website that offers a solution for all needs ... Mix the garlic, ginger, tamari, almond butter, orange juice, salt, ...",https://www.scubabsa.com/pfy859/ingco-vs-lotus.html,36,2022-01-25 04:38:12
Ramadan with Quran (Juz 06) - Muslim Central,"Jul 3, 2020 — ... and our fragrant juice number six Bismillahi Rahmani Raheem, ... he hears the complaint of the oppressed, he hears the daraz of the.",https://muslimcentral.com/taimiyyah-zubair-ramadan-with-quran-juz-06/,37,2022-01-25 04:38:12
"Sultans of Deccan India, 1500–1700: Opulence and Fantasy","For the hypothesis that the painting's saint could be Gesu Daraz, ... in his Nauras (nine juices or essences) cult and praised him throughout his collection ...",https://books.google.com/books?id=oi4nBwAAQBAJ&pg=PA122&lpg=PA122&dq=daraz%2Bjuice&source=bl&ots=brD5Bo8ZdH&sig=ACfU3U2n3tdeCbQtSY_lEsEAyX2c94Trcg&hl=en&sa=X&ved=2ahUKEwiOn_78ucv1AhWnzIsBHXaKCXIQ6AF6BQijARAD,38,2022-01-25 04:38:12
oio,dMart by Daraz: Best Online Grocery Shopping in Pakistan . We talk About the trend of ... Read more Wholesale Fruit Juice. Closed ⋅ Opens at 2:00PM.,http://couturef.com/stwre9c/wholesale-grocery-in-pakistan.html,39,2022-01-25 04:38:12
A Grammar and Dictionary of Indus Kohistani: Dictionary,"... rAy'2, vaiI' juice zus jump, to chAp ho-, zhAl ho- jump around, to pArdk-pArilc' karAv, hu-hd karAv jump down, to darAz karAv jump up, to tArAk-tArAkr ...",https://books.google.com/books?id=Rm9e3tGKnoAC&pg=PA444&lpg=PA444&dq=daraz%2Bjuice&source=bl&ots=RhPRP3RXnO&sig=ACfU3U3ButCxJdg9_kjzgnr-ic294bsccg&hl=en&sa=X&ved=2ahUKEwiOn_78ucv1AhWnzIsBHXaKCXIQ6AF6BQiNARAD,40,2022-01-25 04:38:12
The Hangman: International Crime Thriller - Google Books Result,"... full of soda water to add some sparkle to his glass of orange juice—something she ... her pleas not to be 'stupid' like Daraz, and returned to his room, ...",https://books.google.com/books?id=u2IFEAAAQBAJ&pg=PT57&lpg=PT57&dq=daraz%2Bjuice&source=bl&ots=kDs0b-03ph&sig=ACfU3U1zAnJmS2wqsfoG4lRinyPhGvwF3g&hl=en&sa=X&ved=2ahUKEwiOn_78ucv1AhWnzIsBHXaKCXIQ6AF6BQigARAD,41,2022-01-25 04:38:12
"Sultans of the South: Arts of India's Deccan Courts, 1323-1687","... its title from the prevailing Indian aesthetic theory of nine “juices” (rasa) ... the Prophet Muhammad, and the Sufi saint Gesu Daraz all invoked in the ...",https://books.google.com/books?id=iWNHYID4WqAC&pg=PA26&lpg=PA26&dq=daraz%2Bjuice&source=bl&ots=fkMO6MG0jD&sig=ACfU3U0tsDed8YiR_JtCBVmMWAshgBh9Gg&hl=en&sa=X&ved=2ahUKEwiOn_78ucv1AhWnzIsBHXaKCXIQ6AF6BQiiARAD,42,2022-01-25 04:38:12
India before Europe - Google Books Result,"... by praiseofthe Prophet Muhammad andthenthe Chishti Sufi saint Gesu Daraz. ... viewing painted images and dancing, aswell as wine madefrom nine juices.",https://books.google.com/books?id=1GEWAwAAQBAJ&pg=PT217&lpg=PT217&dq=daraz%2Bjuice&source=bl&ots=4xkka0p5pP&sig=ACfU3U05W0nzZFBlT9tow9TTXFm7ZVnASQ&hl=en&sa=X&ved=2ahUKEwiOn_78ucv1AhWnzIsBHXaKCXIQ6AF6BQikARAD,43,2022-01-25 04:38:12
Winter vegetable market qatar. Flights departing from other ...,"... juice from one lemon half, salt, pepper, and a few tablespoons of water. ... Daraz provides immediate and easy access to 50 million products in over 100 ...",http://elevencourse.com/qekqgt/winter-vegetable-market-qatar.html,44,2022-01-25 04:38:12
Juices - Walmart.com,Fruit Juice; Capri Sun; Apple Juice; Orange Juice; Cranberry Juice; Lemon Juice; Cranberry & Berry Juices; Kombucha & Probiotic Drinks; Aloe Vera Juice,https://www.walmart.com/browse/food/juices/976759_976782_1001321,45,2022-01-25 04:38:12
The Rough Guide to South India - Page 293 - Google Books Result,"... of his beloved spiritual mentor , Bandah Nawaz Gesu Daraz ( see p.291 ) . ... 50m east of the bus stand next to the excellent Karnatak Juice Centre .",https://books.google.com/books?id=sEhJBfbhTAAC&pg=PA293&lpg=PA293&dq=daraz%2Bjuice&source=bl&ots=Q8YeW625YT&sig=ACfU3U3Fmppyu8t1mjRF0q0C-TGFmq5ccw&hl=en&sa=X&ved=2ahUKEwiOn_78ucv1AhWnzIsBHXaKCXIQ6AF6BQilARAD,46,2022-01-25 04:38:12
"Juices / Bottled Beverages, Water & Drink Mixes: Grocery ...","Results 1 - 24 of 4000+ — Online shopping for Grocery & Gourmet Food from a great selection of Fruit Juice, Sparkling Juice, Lemonade, Vegetable Juice, ...",https://www.amazon.com/Juices/b?ie=UTF8&node=16318171,47,2022-01-25 04:38:12
"Shop, Earn, and Get upto 40% Cashback with Savyour",Fashion · Daraz · Beauty & Personal Care · Grocery · Electronics. © 2022 Savyour. All rights reserved · Privacy · Terms ·.,https://savyour.com.pk/,48,2022-01-25 04:38:12
Juice & Lemonade - WebstaurantStore,"Shop our bulk juices and bulk juice drinks for your restaurant or catering business. Wholesale prices, fast shipping and superior service at ...",https://www.webstaurantstore.com/45147/juice.html,49,2022-01-25 04:38:12
THE INDIAN LISTENER: Vol. VIII. No. 2. (7th JANUARY 1943),... Da rab da para yara RAHMAN GUL: Ugda zulmuna kri gesu daraz lari 9.85 News IN pushtu 9.45 * Close down p.m. TRANSMISSION ... Unruly Hair! sime Juice and ...,https://books.google.com/books?id=22TjDwAAQBAJ&pg=PA65&lpg=PA65&dq=daraz%2Bjuice&source=bl&ots=uIKFGG9nWz&sig=ACfU3U3-BjUgRyVzISdUVErTSK2ti4td0w&hl=en&sa=X&ved=2ahUKEwiOn_78ucv1AhWnzIsBHXaKCXIQ6AF6BQifARAD,50,2022-01-25 04:38:12
Guide to 14 Asiatic Languages - Page 24 - Google Books Result,"... a jug jump , to juice jevahir seyahat qadi ; hakim desti sichrasu gohara sefer ... love muhabbet habb qufi tawil daraz ; 24 ENGLISH TURKISH ARABIC ( w . )",https://books.google.com/books?id=frHM0PTDrUgC&pg=PA24&lpg=PA24&dq=daraz%2Bjuice&source=bl&ots=qLC0bLxKvg&sig=ACfU3U2gd8e9q9-C4keJuuCyo1ZNJaV1yg&hl=en&sa=X&ved=2ahUKEwiOn_78ucv1AhWnzIsBHXaKCXIQ6AF6BQihARAD,51,2022-01-25 04:38:12
Juice - Alibaba.com,"Find global selections for your order. Alibaba.com cares for your health with healthy, nutritious juice from organic fruits and veggies.",https://www.alibaba.com/showroom/juice.html,52,2022-01-25 04:38:12
Dr. Juice Cleanse – Make Your Insides Smile!,"JUICE CLEANSE? The organic and safe way for removal of toxins from the body. You can slow down the aging process, have healthy colon enhancement, ...",https://drjuicecleanse.com/,53,2022-01-25 04:38:12
Buy Chocolates in Pakistan - Daraz.pk,"8359 items — Daraz Pakistan Brings You Amazing Online Chocolates Price In Pakistan. Get Huge Discounts, Vouchers, Emi And Cash On Delivery Options In Karachi, ...Rs.150 OFF for New Users! ✓10% Extra Bank Discount on Dark Chocolate at Daraz.pk. ✓Low Prices ✓Fast Delivery across Pakistan.",https://www.daraz.pk/chocolates/,0,2022-01-25 04:38:15
Buy Chocolate Truffle & Assortments at Best Price in Srilanka,"5536 items — Shop for best Chocolate Truffles online at Daraz Sri Lanka. Get wide variety of candy & chocolate, Great prices and even better service.",https://www.daraz.lk/chocolates/,1,2022-01-25 04:38:15
Buy Chocolate Online - Daraz.com.np,"221 items — Best deals on dark chocolate price in Nepal from Daraz np. Shop high quality hot chocolate, chocolate chip cookies, white chocolate at best price ...",https://www.daraz.com.np/chocolates/,2,2022-01-25 04:38:15
250gm Dark Chocolate From Daraz 20211020 - YouTube,,https://www.youtube.com/watch?v=7oqQFYB4pXo,3,2022-01-25 04:38:15
Bird cage daraz. Automatic Bird Feeder Food Distributor Cage ...,Daraz is the ultimate Nepali eCommerce website that offers a solution for all ... In farblaserdrucker samsung c1810w nestle toll house chocolate raspberry ...,https://tokyomarunouchipartnership.com/qqhvb/bird-cage-daraz.html,4,2022-01-25 04:38:15
"Daraz Online Shopping, profile picture - Facebook","May 22, 2020 — Hazella Chocolate Vanilla Spread Shop now: https://bit.ly/3cX0qkU.",https://www.facebook.com/daraznp/photos/hazella-chocolate-vanilla-spreadshop-now-httpsbitly3cx0qku/2675861766067271/,5,2022-01-25 04:38:15
Toblerone Chocolate Price in Pakistan,"Feb 4, 2021 — Toblerone Milk Chocolate With Fruit & Nuts 2 Bars Of 100 Grams Each (made In Sw… not found. daraz.pk. 5.0. Rs. 1,000.",https://shopsy.pk/toblerone-chocolate,6,2022-01-25 04:38:15
Empty gift basket daraz. A thoughtful gift for a man who travels ...,"1186 items — The sale will Daraz, South Asia's leading e-commerce marketplace, ... 00 Gift Now; Chocolate gift baskets are a sweet gift to complete any ...",http://patagonicapropiedades.com/lae7y3/empty-gift-basket-daraz.html,7,2022-01-25 04:38:15
daraz on Vimeo,,https://vimeo.com/669100151,8,2022-01-25 04:38:15
Naheed.pk - Online Shopping in Pakistan: Cosmetics ...,"Secure online shopping in Pakistan. Shop online at Pakistan's most trusted online shopping store. Buy Makeup, Grocery, Health & Beauty Products, Mobiles, ...",https://www.naheed.pk/,9,2022-01-25 04:38:15
"Shwapno Online Grocery Shopping in Dhaka, Chattogram ...","Order grocery online, save money, save time.",https://www.shwapno.com/,10,2022-01-25 04:38:15
Milk rate in pakistan today. Fulfilled by Amazon. Find a country ...,"Samll Chocolate Hersheys 100g 1,6 - 2 USD. ... dMart Daraz takes pride in the fact that it offers one of the best online grocery shopping price in Pakistan.",http://7new.com.br/8pinro7/milk-rate-in-pakistan-today.html,11,2022-01-25 04:38:15
Online books delivery lahore. The best place to buy books ...,Taj Ramzan App. Death By Chocolate Cake - 4 lbs. 50% Off Books for All Ages. ... TCS has additionally consented to an arrangement with Daraz.,http://kufuorfoundation.org/jxn7nx/online-books-delivery-lahore.html,12,2022-01-25 04:38:15
Butterfly knife olx. Anatomy of a Fox 479 Folding Karambit ...,Daraz provides immediate and easy access to 50 million products in over 100 ... olx ghana cars kumasi olx ghana cars taxi one chocolate chip cookie dough ...,https://raleighcivicsymphony.com/jdzqap/butterfly-knife-olx.html,13,2022-01-25 04:38:15
Power full energy drink price in pakistan. It is filled with 27 ...,"3361 results — Tasty and trusted, Milo brand is the world's leading chocolate malt beverage ... from the most trusted online stores in Pakistan such as daraz.",https://athmsi.org/dclbvzh/power-full-energy-drink-price-in-pakistan.html,14,2022-01-25 04:38:15
Homemade Chocolate Bars - Just 3 Ingredients!,"Aug 16, 2020 — For low carb, sugar free, and keto chocolate bars, combine the following in a bowl until smooth: 1/2 cup cacao or cocoa powder, 1/4 cup melted ...",https://chocolatecoveredkatie.com/three-ingredient-chocolate-bars-1/,15,2022-01-25 04:38:15
Pantene song. Why Pantene's Gender Inequality Ad Is Total ...,"Visit Pantene on Daraz. ... Advertisements: Cadbury 's Chocolate , most notably the Victoria's Secret 'Pajamas Sale'; [5] television commercial of November ...",http://vzcommunications.com/ihdnxrl/pantene-song.html,16,2022-01-25 04:38:15
Jazz recharge code. Here you can easily top up your call ...,"3 days ago — ... dove chocolate coupons june 2019, whitening lightning coupon code, ... Daraz. Get Code. The following Email Policy was developed to help ...",http://adnac.fr/911svgy/jazz-recharge-code.html,17,2022-01-25 04:38:15
Solv seller login. Contact your bank about payment security ...,"To find the number of pounds of chocolate chips, substitute n = 16 into the ... 800-300-3838 Login How To Solve Problems With Daraz Seller Account - All In ...",http://maastik.com.br/10hbind/solv-seller-login.html,18,2022-01-25 04:38:15
Wood safe almari price in pakistan. Furniture Lahore 2 months ...,30 results — Preferably with a cup of tea and a great big slice of chocolate cake! ... collected from the most trusted online stores in Pakistan such as daraz.,http://katewatson.org/zcczal/wood-safe-almari-price-in-pakistan.html,19,2022-01-25 04:38:15
Bbf restaurant. A restaurant chain is a set of related ...,"Welcome to a new era of E-commerce where Daraz is an exciting new part of your daily life. ... Orlando Ave, Cocoa Beach, FL 32931.",https://prettyview.ca/cheqr/bbf-restaurant.html,20,2022-01-25 04:38:15
Here's the complete list of YouTube channels banned,3 days ago — Umar Daraz Gondal; Khoji TV; Khoji TV 2.0; Cover Point; Junaid Flix; National Studio; Informative World; DunyaOfficial; Studio360; Haqeeqat Tv ...,https://timesofindia.indiatimes.com/gadgets-news/heres-the-complete-list-of-youtube-channels-banned-by-the-government-for-spreading-anti-india-fake-news/articleshow/89055193.cms,21,2022-01-25 04:38:15
How to sell hookah online. Nicotine is an addictive chemical ...,"Cozy décor. blu e cig daraz online shopping e cigarette amazon e cigarette ... Relish the smoky flavours of apple, chocolate, coconut, mint, watermelon, ...",http://cashborosa.es/mjmgunq/how-to-sell-hookah-online.html,22,2022-01-25 04:38:15
Kutta bhonk raha hai in english. DFDSFEEGGR About Kutta ...,"Usme milega ek chocolate Samaj ka tu kutta hai tu kutta hai toh bhonk le ... i am afraid, its fighting, lag raha hai, bhonk raha hai. thnx daraz: 222: Khana ...",http://atiyehvadood.com/pu7cfg/kutta-bhonk-raha-hai-in-english.html,23,2022-01-25 04:38:15
Buy books online in pakistan. Contact 03336042057 ...,"... send cake, flower bouquet, chocolate basket, unique gifts and many more no ... +923 111 999 560 Buy Homeopathic Medicines Online in Pakistan at Daraz.",http://somoyerkotha.com/gmosau/buy-books-online-in-pakistan.html,24,2022-01-25 04:38:15
Deliveroo head office. Deliveroo to create 400 tech roles in ...,"You can even get a cup of our signature hot chocolate without leaving the ... After Alipay, British Airways, Deliveroo and Air BnB, Daraz gets a ne You can ...",https://themainstageproductions.com/67bgns/deliveroo-head-office.html,25,2022-01-25 04:38:15
Kitchen hob price in pakistan. Buy gas stoves online at lowest ...,"... two honors: the Stove Price in Pakistan - Latest Jan, 2022 Prices. com, daraz. ... It is decorated with vanilla icing and chocolate shaving all over th.",https://twistednturned.com/smkwe0/kitchen-hob-price-in-pakistan.html,26,2022-01-25 04:38:15
Western Armenian Dictionary & Phrasebook:,... roof dapad trousers daradzel to spread daraz uniform daregan : Kani daregan es ? ... box door indzi give me ... doorm chocolate doozh shower dzag hole ...,https://books.google.com/books?id=4sRmU6FrOk8C&pg=PA35&lpg=PA35&dq=daraz%2Bchocolate&source=bl&ots=xYgvGAq-V2&sig=ACfU3U05HR74S-V7r9XyilTAdtlPug0FuA&hl=en&sa=X&ved=2ahUKEwi90Kb9ucv1AhXgyzgGHVfOBw8Q6AF6BQiiARAD,27,2022-01-25 04:38:15
Winter vegetable market qatar. Flights departing from other ...,"Hot chocolate. ... Daraz provides immediate and easy access to 50 million products in over 100 categories, delivering more than 6 million packages every ...",http://elevencourse.com/qekqgt/winter-vegetable-market-qatar.html,28,2022-01-25 04:38:15
