title,snippet,link,position,date
rws,"Daraz One day delivery is a great system for you as you can get your order at ... will arrive fresh and cool, whether it's Gulab Jamun or Chocolate Mousse.",http://villacorteazul.nl/myodgh/online-books-delivery-karachi.html,29,2022-01-25 04:38:15
Morinaga bf3. Grocery. You have no items in your cart. 16 ...,Visit Morinaga on Daraz. (2013) 171:72–9. ... Get the best price for Morinaga Milk 3 among 31 products. morinaga bf chil school 4 chocolate 600gm rs.,http://charlotte-harris.net/7aetg/morinaga-bf3.html,30,2022-01-25 04:38:15
"Spanish Hot Chocolate (Chocolate a la Taza) - Oh, The ...",Chocolate a la taza is the name of the thick hot chocolate typically served with churros in Spain. It's easy to make it with this 2 ingredient recipe.,https://thethingswellmake.com/chocolate-la-taza-churros-chocolate/,31,2022-01-25 04:38:15
Buy Chocolate online at Best Prices in UAE | Amazon.ae,"Shop online for Chocolate at Amazon.ae. Choose from our online grocery store the best Chocolate in UAE at best prices. Fast and free shipping, free returns ...",https://www.amazon.ae/Chocolate/b?ie=UTF8&node=15160147031,32,2022-01-25 04:38:15
THE INDIAN LISTENER: Vol. VIII. No. 15. (22nd JULY 1943),... Sung by INDIRA and tani bv “Chocolate cake”: INTISAR HUSAIN: Khudgharaz ... Dadra Feature in Hindustani by Din bhi daraz rat bhi kyon hai firaq-i-yar ...,https://books.google.com/books?id=exjkDwAAQBAJ&pg=PA83&lpg=PA83&dq=daraz%2Bchocolate&source=bl&ots=UEP7EpAmkC&sig=ACfU3U1_bKQ5AbDcgPvjH_5l6NMygoMoSw&hl=en&sa=X&ved=2ahUKEwi90Kb9ucv1AhXgyzgGHVfOBw8Q6AF6BQikARAD,33,2022-01-25 04:38:15
chocolates - Pmart.pk,PMART.PK-PAKISTAN MART- ONLINE GROCERY STORE SNACKS Perk Choc 7.2gm · PMART. · Snickers Chocolate 50 gm · Cadbury Dairy Milk Chocolate Mini Bars Pouch 160 gm.,https://pmart.pk/collections/chocolates,34,2022-01-25 04:38:15
Diario de avisos de Madrid - Page 2 - Google Books Result,En el zoismo se despacha chocolate de Vallá dolid del mas superior de aquel pais ' desde 6 a ... tienda de lienzos daraz cuartos on .. montadat a - razon .,https://translate.google.com/translate?hl=en&sl=es&u=https://books.google.com/books%3Fid%3Dee7O0Wt2g1QC%26pg%3DRA60-PA2%26lpg%3DRA60-PA2%26dq%3Ddaraz%252Bchocolate%26source%3Dbl%26ots%3Dx_ZIonyENm%26sig%3DACfU3U2Hv52csTAoE3bif-C0xqjoXHPQ3g&prev=search&pto=aue,35,2022-01-25 04:38:15
Juice - Chaldal Online Grocery Shopping and Delivery in ...,Pran Drinko Litchi Juice · Latina 100 % Juice (Apple) · Latina 100 % Juice (Orange) · Nutrilife Juice (Mango) · SMC Plus Orange Flavor (250 ml x 6 pcs Combo Pack).,https://chaldal.com/juice,0,2022-01-25 04:39:01
"Milk, Juice & Drinks - Chaldal Online Grocery Shopping and ...",Order grocery and food online with same-day home delivery.,https://chaldal.com/milk-juice-drinks,1,2022-01-25 04:39:01
Real Fruit Power Cranberry Juice - Chaldal,Why Choose Chaldal? Real Fruit Power Cranberry Juice.,https://chaldal.com/real-fruit-power-cranberry-juice-1-ltr,2,2022-01-25 04:39:01
Fontana Grape Juice - Chaldal Online Grocery Shopping and ...,Product Type: Juice. • Brand Name: Fontana. • Flavor: Grape. • 100% Natural.,https://chaldal.com/fontana-grape-juice-1-ltr,3,2022-01-25 04:39:01
Masafi Apple Juice - Chaldal Online Grocery Shopping and ...,Masafi juices offer a rich and natural experience of wholesome fruit blends ...,https://chaldal.com/masafi-apple-juice-1-ltr,4,2022-01-25 04:39:01
Ceres Apple juice - Chaldal Online Grocery Shopping and ...,Order grocery and food online with same-day home delivery.,https://chaldal.com/ceres-apple-juice-1-ltr-2,5,2022-01-25 04:39:01
Fontana Mango Juice - Chaldal Online Grocery Shopping and ...,Product Type: Juice. • Brand Name: Fontana. • Flavor: Mango. • 100% Natural.,https://chaldal.com/fontana-mango-juice-1-ltr,6,2022-01-25 04:39:01
Cyprina Juice Drink Apple - Chaldal,Order grocery and food online with same-day home delivery.,https://chaldal.com/cyprina-juice-drink-apple-1-ltr,7,2022-01-25 04:39:01
Fontana Orange Juice - Chaldal,Order grocery and food online with same-day home delivery.,https://chaldal.com/fontana-orange-juice-1-ltr,8,2022-01-25 04:39:01
Sammi Strawberry Juice Can - 250 ml - Chaldal,Order grocery and food online with same-day home delivery.,https://chaldal.com/sammi-strawberry-juice-can-250-ml,9,2022-01-25 04:39:01
Aaram Juice Apple - Chaldal Online Grocery Shopping and ...,Square Food & Beverage Ltd. has launched Aaram 100% Fruit Juice and marked ...,https://chaldal.com/aaram-juice-apple-1-ltr,10,2022-01-25 04:39:01
Tipco Medley Orange Juice - Chaldal,Order grocery and food online with same-day home delivery.,https://chaldal.com/tipco-medley-orange-juice-1-ltr,11,2022-01-25 04:39:01
Latina 100 % Juice (Mango) - Chaldal,Order grocery and food online with same-day home delivery.,https://chaldal.com/latina-100-juice-mango-1-ltr,12,2022-01-25 04:39:01
Ceres Orange juice - Chaldal Online Grocery Shopping and ...,Order grocery and food online with same-day home delivery.,https://chaldal.com/ceres-orange-juice-1-ltr-2,13,2022-01-25 04:39:01
Pran Drinko Mango Juice - Chaldal,Order grocery and food online with same-day home delivery.,https://chaldal.com/pran-drinko-mango-juice-250-ml-2,14,2022-01-25 04:39:01
Fontana Apple Juice - Chaldal Online Grocery Shopping and ...,Order grocery and food online with same-day home delivery.,https://chaldal.com/fontana-apple-juice-1-ltr,15,2022-01-25 04:39:01
Masafi Mango Nectar Juice - Chaldal,Order grocery and food online with same-day home delivery.,https://chaldal.com/masafi-mango-nectar-juice-1-ltr-2,16,2022-01-25 04:39:01
Ceres Necter Mango Juice - Chaldal,Order grocery and food online with same-day home delivery.,https://chaldal.com/ceres-necter-mango-juice-1-ltr,17,2022-01-25 04:39:01
Sun Sweet Prune Juice - Chaldal,Order grocery and food online with same-day home delivery.,https://chaldal.com/sun-sweet-prune-juice-946-ml,18,2022-01-25 04:39:01
Ceres Necter Orange Juice - Chaldal,Order grocery and food online with same-day home delivery.,https://chaldal.com/ceres-necter-orange-juice-1-ltr,19,2022-01-25 04:39:01
Fontana Apple Juice - Chaldal Online Grocery Shopping and ...,Product Type: Juice. • Brand Name: Fontana. • Flavor: Apple. • 100% Natural.,https://chaldal.com/fontana-apple-juice-1-ltr-2,20,2022-01-25 04:39:01
Beverages - Chaldal Online Grocery Shopping and Delivery in ...,Stationery & Office · Home & Kitchen · Vehicle Essentials. Start Shopping. Food · Beverages · Tea. Coffee. Juice. Soft Drinks. Water. Syrups & Powder Drinks.,https://chaldal.com/beverages,21,2022-01-25 04:39:01
Fontana Pineapple Juice - Why Choose Chaldal?,Order grocery and food online with same-day home delivery.,https://chaldal.com/fontana-pineapple-juice-1-ltr-2,22,2022-01-25 04:39:01
Nestle Fruita Vitals Apple Juice - Chaldal,Order grocery and food online with same-day home delivery.,https://chaldal.com/nestle-fruita-vitals-apple-juice-1-ltr,23,2022-01-25 04:39:01
Nutrilife Juice (Guava) - Chaldal Online Grocery Shopping and ...,Why Choose Chaldal? Nutrilife Juice (Guava). 160 ml. ৳35. Request Stock. Favourite Incorrect Info? Claim your 3% Discount. Apply to Cart.,https://chaldal.com/nutrilife-juice-guava-160-ml,24,2022-01-25 04:39:01
Nestle Fruita Vitals Mango Juice (Free Noodles 2 pcs) - Chaldal,Order grocery and food online with same-day home delivery.,https://chaldal.com/nestle-fruita-vitals-mango-juice-free-noodles-2-pcs1-ltr,25,2022-01-25 04:39:01
Nestle Fruita Vitals Apple Juice (Free Noodles 2 pcs) - Chaldal,Order grocery and food online with same-day home delivery.,https://chaldal.com/nestle-fruita-vitals-apple-juice-free-noodles-2-pcs-1-ltr,26,2022-01-25 04:39:01
Chal Dal Peyaj Ada etc - Banasree Paikari Bazar,"Soft Drinks & Juice · Banasree Paikari Bazar. All, Acher (3), Baby Diapers (52), Baby Food (27), Baby Wipes (7), Bath & Body Soap (46), Chal Dal Peyaj Ada ...",https://bpbazar.xyz/product-category/chal-dal-peyaj-ada-etc/,27,2022-01-25 04:39:01
Pin on Global News - Pinterest,"With these in mind, the e-commerce site chaldal.com has started a unique mango ... 10 Summer Smoothies for Glowing Skin | Mango Tango Spinach Smoothie Juice ...Sep 23, 2018 - Beetroot is in low fat, so you can make juice and enjoy your drinks ... Beetroot ±25 gm - Chaldal Online Grocery Shopping and Delivery in ...",https://www.pinterest.com/pin/780107966707835126/,28,2022-01-25 04:39:01
Latina 100 % Juice (Orange) 1 ltr ৳189 - Facebook,"7 mos Report. Chaldal, profile picture. Chaldal. Nestle Fruita Vitals Chaunsa Mango Juice (Free Maggi Masala Blast 2 pcs) 1 ltr ৳340Nestle Fruita Vitals Chaunsa Mango Juice ১ লিটার কিনলেই ... May be an image of food and text that says 'Chaldal com Sip Positive Flavourful.",https://x.facebook.com/chaldalcom/photos/a.156950311157718/1762217250631008/?type=3&source=48,29,2022-01-25 04:39:01
(Chaldal.com)Term paper on changed consumer ... - StuDocu,"Dec 27, 2021 — Identify changed consumer behavior due to the COVID-19 pandemic. Guidelines: Select a company that is operating online, has apps, ...",https://www.studocu.com/row/document/east-west-university/marketing-management/chaldalcomterm-paper-on-changed-consumer-behavior-due-to-covid-19-pandemic/21146962,30,2022-01-25 04:39:01
Baby Diapers In Bangladesh - Buy Diapers Online At Chaldal ...,"Buy baby diapers online at Chaldal.com. Find best diaper prices in Bangladesh for Huggies, ... Pran Drinko Litchi Juice. 250 ml. ৳ 30. Add to Shopping Bag.",https://diaper.com.bd/,31,2022-01-25 04:39:01
Read the Articel below and Answer the question PepsiCo ...,"PepsiCo introduces “Tropicana” juice brand to Bangladesh with the launch of ... online-shopping platforms such as Chaldal, Daraz, Meenaclick, and others.",https://www.chegg.com/homework-help/questions-and-answers/read-articel-answer-question-pepsico-introduces-tropicana-juice-brand-bangladesh-launch-tr-q80209720,32,2022-01-25 04:39:01
Sangita Quadir - chaldal limited - LinkedIn Bangladesh,"chaldal limited at Chaldal. Chaldal. Dhaka, Dhaka, Bangladesh ... Telesales Deputy Incharge at Chaldal. Jessore ... Selse operator at Juice factory. Dhaka ...",https://bd.linkedin.com/in/sangita-quadir-592167216,33,2022-01-25 04:39:01
Kanij Sabrina Rahman on Behance,Just Juice Social Media Posts · Kanij Sabrina Rahman ... Chaldal Social Media Posts · Kanij Sabrina Rahman ... Chaldal Cover Videos · Kanij Sabrina Rahman.,https://www.behance.net/goldenbengali/followers,34,2022-01-25 04:39:01
Grocery - Dribbble,Chaldal - Grocery Shop App Redesign clean creative green clean app minimal ... Fresh Juice App ux ui ecommerce product application restaurant cane ios clean ...,https://dribbble.com/tags/grocery?page=13,35,2022-01-25 04:39:01
(Chaldal.com)Term paper on changed ... - Course Hero,"Dec 27, 2021 — View (Chaldal.com)Term paper on changed consumer behavior due to COVID-19 ... Honey, groceries, Dry Fish, Fruits, and Juice are some of the ...",https://www.coursehero.com/file/124753596/ChaldalcomTerm-paper-on-changed-consumer-behavior-due-to-COVID-19-pandemicdocx/,36,2022-01-25 04:39:01
Chaldal Masaodi | PDF - Scribd,Juice. Shezan Mango Juice. PRAN Junior Mango Fruit Drink PRAN Mango Fruit Drink Tang Mango Drink Stute Cranberry Juice PRAN Frooto Mango Fruit Drink,https://www.scribd.com/document/353128647/chaldal-masaodi,37,2022-01-25 04:39:01
Pran Chinigura Rice (1 kg) - Your First Choice - Mohajon Shop,"All categories, Grocery, Atta Moida Semai Suji, Beverages, Juice & Powder Drink, Soft Drinks & Water, Tea & Coffee, Breakfast, Chocolate & Candy ...",https://mohajonshop.com.bd/shop/pran-chinigura-rice-1-kg/,38,2022-01-25 04:39:01
Y Combinator-backed delivery startup Chaldal raises $5.5 million for ...,"Arador Tech News. Y Combinator-backed delivery startup Chaldal raises $5.5 million for 'nano-warehouse' technology. EXCLUSIVE: At 19,447 people per square ...",https://arador.com/y-combinator-backed-delivery-startup-chaldal-raises-5-5-million-for-nano-warehouse-technology/,39,2022-01-25 04:39:01
Bashundhara Facial Tissue (Chaldal Logo) 120X2 ply_1 Piece,Be the first to review “Bashundhara Facial Tissue (Chaldal Logo) 120X2 ply_1 Piece” Cancel reply. You must be logged in to post a review.,https://amrhat.com/product/bashundhara-facial-tissue-chaldal-logo-120x2-ply_1-piece/,40,2022-01-25 04:39:01
WeeBasket | Tracxn,"... laundry & cleaning, beauty care products, drinks & juices, and more. ... Similar Cos.bigbasket, Grofers, Chaldal, Rohlik.cz, SayWeee & 1394 others ...",https://tracxn.com/d/companies/weebasket.com,41,2022-01-25 04:39:01
"Chaldal.com, Dhaka (+880 1881-234567) - VYMaps.com",Buy your favorite mangoes to make delicious mango juice in restaurant style at Chaldal https://rebrand.ly/MangoJuice Video Collected From-'My Hesselghar' ...,https://vymaps.com/BD/Chaldal-com-782932/,42,2022-01-25 04:39:01
"Diaper Wet wipe Towel Chaldal, cream, baby png | PNGEgg","Diaper Pampers Baby-Dry Infant Child, Pampers, child, infant png 2000x2000px 2.61MB; round red fruit art, Juice Nectarine Fruit Apricot Saturn Peach, ...",https://www.pngegg.com/en/png-ctdyh,43,2022-01-25 04:39:01
Bashundhara Facial Tissue (Chaldal Logo) 120X2 ply – Minimart BD,Bashundhara Facial Tissue (Chaldal Logo) 120X2 ply · Bashundhara Facial Tissue (Chaldal Logo) 120X2 ply · Reviews · Related products · Bashundhara Paper Napkins 13″ ...,https://minimart-bd.com/product/bashundhara-facial-tissue-chaldal-logo-120x2-ply/,44,2022-01-25 04:39:01
Help Center - Zazabar,A Chaldal representative will then deliver your order right to your home or office. Q. How much do deliveries cost? A. There is a BDT 9 delivery fee if the ...,https://zazabar.com.bd/Help_center/index/Help_center.html,45,2022-01-25 04:39:01
Bashundhara Facial Tissue (Chaldal Logo) 120X2 ply - AMAR ...,Water · Soft Drinks · Juice · Syrups & Powder Drinks · Milk & Dairy · Milk Powder & Cream · Condensed Milk · Butter & Sour Cream · Liquid Milk.,https://amargrocery.com/product/Bashundhara-Facial-Tissue-Chaldal-Logo-120X2-ply-PUyR8,46,2022-01-25 04:39:01
Latina 100 % Juice (Orange) - Akasnil.com,Latina 100 % Juice (Orange)Product Details:Chaldal has a range of locally sourced 100% natural pulp fruit juice. And Latina Orange Juice is one of them.,https://www.akasnil.com/product/Latina-100--Juice-Orange,47,2022-01-25 04:39:01
Potato Seasonal (Net Weight ± 50 gm) - ChaiChaiBD,"So, make new recipes with new potato from chaldal. Please Select, 1 Kg. Qty. ADD TO CART. Description; Additional information; Reviews (1).",https://www.chaichaibd.com/public/product-details/potato-seasonal-net-weight-50-gm,48,2022-01-25 04:39:01
Bashundhara Facial Tissue (Chaldal Logo) 120X2 ply - Bazar ...,"Descriptive, Munchies is an Late night food delivery service in Dhaka City, Munchies is an online e-commerce platform where you can get your necessary items ...",https://bazarlagbe.net/product/bashundhara-facial-tissue-chaldal-logo-120x2-ply/,49,2022-01-25 04:39:01
chaldal | Daraz Life - Daraz BD Blog,online grocery shop | psg jersey | sepnil face mask | vivi juice | aloe vera gel | shop2game | tws m10 earphone | m19 tws earphone | jvco tv | plextone g20 ...,https://blog.daraz.com.bd/2021/09/02/top-grocery-apps-in-bangladesh/chaldal/,50,2022-01-25 04:39:01
‎Chaldal: Online Grocery on the App Store,"Aug 28, 2021 — Chaldal will make your life easier in Dhaka, Chattogram and Jashore. We believe the time is valuable to our fellow Dhaka, Chattogram and ...",https://apps.apple.com/hr/app/chaldal-online-grocery/id1104493220,51,2022-01-25 04:39:01
Starship Mango Juice 200 ml - Wali Bazar,"Starship Mango Juice 200 ml, price- 16 tk, Walibazar.com is a online bazar where you can easily shopping all daily necessary goods from your home or office.",https://www.walibazar.com/product/starship-mango-juice-200-ml/,52,2022-01-25 04:39:01
Bashundhara Facial Tissue (Chaldal Logo) 120X2 ply,Bashundhara Facial Tissue (Chaldal Logo) 120X2 ply. ৳ 62.00. Quantity. Add to cart. Category: Napkins & Paper Products Tag: Bashundhara Facial Tissue ...,https://hatureya.com/product/bashundhara-facial-tissue-chaldal-logo-120x2-ply/,53,2022-01-25 04:39:01
9 Best Online Grocery Shops In Bangladesh (Home Delivery),"Jan 1, 2022 — Chaldal.com is one of the pioneers of online grocers in Bangladesh. ... Honey, Grocery, Dry Fish, Fruits, and Juice are some regular ...",https://deshiz.com/online-grocery-shops-bangladesh/,54,2022-01-25 04:39:01
Where to Buy Grocery Online in Dhaka during Quarantine?,"Mar 30, 2020 — Chaldal.com is one of the most popular grocery based e-commerce ... shemai, honey, jelly, Juice chatni, chickpeas, and many more food items.",https://www.unb.com.bd/category/lifestyle/where-to-buy-grocery-online-in-dhaka-during-quarantine/48301,55,2022-01-25 04:39:01
5 Popular Online Grocery Shopping Site in Bangladesh - Reddit,"Although some of the e-commerce industries like as chaldal, khasfood, meenaclick, torkaribazar and more focus only on grocery & food products.",https://www.reddit.com/user/Bagdoombd/comments/bdcw3n/5_popular_online_grocery_shopping_site_in/,56,2022-01-25 04:39:01
Pineapple - Chaldal Online Grocery Shopping and Delivery in ... in ...,Food Order Details: Choose Pineapple - Chaldal Online Grocery Shopping and Delivery in ... Tropicana Pineapple Juice - 200ml Pineapple Fruit Juice Buy .,https://allindiafood.com/City-Wise-Food-Services-Search-Result.aspx?CategoryId=94683&SearchTerm=Pineapple%20-%20Chaldal%20Online%20Grocery%20Shopping%20and%20Delivery%20in%20...&CityName=%20%20%20%20%20%20%20%20%20%20%20%20%20%20%20%20%20Kolkata/vendor/phpunit/phpunit/build.xml,57,2022-01-25 04:39:01
MeenaClick: Home,"MeenaClick is an online grocery shop with 90 minutes delivery. It has cashless pay at every doorstep delivery, 8 favorable delivery slots, pick from store ...",https://www.meenaclick.com/,58,2022-01-25 04:39:01
Chaldal ðŸ¥š Online Grocery Shopping and Delivery in Dhaka,"CHALDAL ONLINE GROCERY SHOPPING AND DELIVERY INOFFERSNEW ARRIVALPOPULARBABY ... It is a super food for roasting, blending it in blender and make juice, ...",https://www.archivebay.com/site/chaldal.com--2019-09-09__12-41-33,59,2022-01-25 04:39:01
Aloe Vera Lotion Food Hand Washing Neem Tree PNG,"Aug 23, 2018 — This PNG image was uploaded on August 23, 2018, 8:09 am by user: Puritysan and is about Aloe, Aloe Vera, Bag, Bangladesh, Chaldal.",https://imgbin.com/png/ZgDFmzug/aloe-vera-lotion-food-hand-washing-neem-tree-png,60,2022-01-25 04:39:01
Broiler Chicken Skin On - Net 1 kg - Shoros | সঠিক মূল্যে ...,... in line just to buy basic necessities like Grocery! This is why Chaldal delivers everything you need right at your door-step and at no additional cost.,https://shoros.com/product/broiler-chicken-skin-on-net-1-kg,61,2022-01-25 04:39:01
Coronavirus Home Quarantine: Where to buy online grocery ...,"Mar 31, 2020 — Chaldal.com is one of the most popular grocery based e-commerce website ... honey, jelly, Juice chatni, chickpeas, and many more food items.",https://sylhetmirror.com/2020/03/31/coronavirus-home-quarantine-where-to-buy-online-grocery-in-dhaka-during-quarantine/,62,2022-01-25 04:39:01
Top 9 Grocery Store | Best Online Grocery Shops in Bangladesh,"Dec 24, 2020 — Chaldal.com is one of the pioneers of the best online grocery shop in ... Honey, Grocery, Dry Fish, Fruits, and Juice are some regular ...",https://www.chococraving.com/best-online-grocery-shops-in-bangladesh/,63,2022-01-25 04:39:01
Chal/Dal/Tel/Dim – Jogandar Retail,Baby foods · Bakery · Cereals · Dairy Item · Drinks and Juice · Frozen foods · Healthcare · Home and Cleaning · Air freshner · Dish washer ...,https://jogandar.net/product-category/nitto-ponno/chal-dal-tel-dim/,64,2022-01-25 04:39:01
Grocery shopping on the internet | The Daily Star,"Chaldal.com is one of the first online grocers in Bangladesh. ... honey, pure ghee to dry fruits and fish, juice, organic tea, and other daily staples.",https://www.thedailystar.net/lifestyle/spotlight/news/grocery-shopping-the-internet-1903819,65,2022-01-25 04:39:01
Healthy iftar recipes | Dhaka Tribune,"May 18, 2019 — Mix ½ cup water with two tablespoons of sugar with juice from two slices of lime, ... Chaldal and Cookups announce exciting partnership ...",https://archive.dhakatribune.com/feature/food/2019/05/18/healthy-iftar-recipies,66,2022-01-25 04:39:01
chaldal.com estimated website worth and domain value is ...,"Mar 26, 2021 — Majestic Citation Flow is a score between 0 and 100 to measure the link power the website or link carries. It reflects the amount of “link juice ...",https://www.siteprice.org/website-worth/chaldal.com,67,2022-01-25 04:39:01
DANO Sterilized Cream (2021) - FoodBevg,"You can now buy your favorite DANO Sterilized Cream online from Chaldal at: ... Add the yogurt and lemon juice; cover and cook until the lamb is tender, ...",https://www.foodbevg.com/XX/Unknown/1489537264634550/DANO-Sterilized-Cream,68,2022-01-25 04:39:01
Latina 100 % Juice (Orange) ( 1 ltr ) - Products Details ...,Product Description. Quantity : 1 ltr. Chaldal has a range of locally sourced 100% natural pulp fruit juice. And Latina Orange Juice is one of them.,https://www.mudidokan.com.bd/product-details/2248/latina-100-juice-orange-1-ltr,69,2022-01-25 04:39:01
Challo Juice (@challojuice) is on Instagram,"11.5k Followers, 116 Following, 188 Posts - See Instagram photos and videos from Challo Juice (@challojuice)",https://www.instagram.com/challojuice/?hl=en,70,2022-01-25 04:39:01
How can I get the best content for my site chaldal.com? - Quora,Reduce your ideal customer/site visitor down to just ONE PERSON! Everything you write on your website is for this person's benefit.,https://www.quora.com/How-can-I-get-the-best-content-for-my-site-chaldal-com,71,2022-01-25 04:39:01
This Pre-Gym Snack Could Dramatically Boost Your Workout,"Jun 16, 2017 — Many a fitness guru have suggested that drinking beetroot juice before a workout can boost performance, improve blood and oxygen flow to ...",https://www.delish.com/kitchen-tools/advice/a53773/eating-this-before-a-workout-could-improve-your-results/,72,2022-01-25 04:39:01
chaldal xxx videos - xpornplease.com,"Watch chaldal on xpornplease, the best internet porn site. Download chaldal porn movies. ... gangbang ebony slut covered in white penis juice ...",https://www.xpornplease.com/tags/chaldal/,73,2022-01-25 04:39:01
Turkish Şalgam Suyu Recipe - The Spruce Eats,"Jul 8, 2021 — Follow our recipe to make Şalgam juice, a popular fermented drink from the southeast of Turkey, made from purple carrots.",https://www.thespruceeats.com/salgam-suyu-overview-3274140,74,2022-01-25 04:39:01
Bashundhara Facial Tissue - Cake Shop,Bashundhara Facial Tissue. ৳ 65. Bashundhara Facial Tissue (Chaldal Logo) 120X2 ply.,https://cakeshop.com.bd/product/bashundhara-facial-tissue-chaldal-logo-120x2-ply/,75,2022-01-25 04:39:01
"Saffola, Parachute Oil - 50% Discount Eid 2021 Offer - JotoDeal","Apr 29, 2021 — Chaldal (চালডাল) Eid 2021 Offer, 50% discount offer (ডিসকাউন্ট অফার) on all marico Bangladesh products (ম্যারিকো ...",https://jotodeal.com/chaldal-saffola-oil-eid-offer-2021/,76,2022-01-25 04:39:01
How to Make Pineapple Juice - Tastessence,"Fresh Pineapple Juice Recipe. Ingredients Required. Large pineapple, 1; Sugar, 2 teaspoons; Water, 2 to 3 cups; Crushed ice. Juicing It Up",https://tastessence.com/how-to-make-pineapple-juice,77,2022-01-25 04:39:01
