title,snippet,link,position,date
Augmented (AR) & Virtual Reality (VR) Accessory Lens - Jadak,Accessory that attaches to a spectroradiometer which measures light from AR/VR target areas in the range 0.3 – 6 mm.,https://www.jadaktech.com/products/photo-research/augmented-ar-virtual-reality-vr-accessory-lens/,68,2022-01-25 05:26:59
One of the First and Foremost Exponents of AR and VR ...,"One of the first and foremost exponents of AR and VR technologies in Bangladesh. Web, app and game development as well as creative marketing is also our ...",https://youngbusinesshub.org/success-stories/batterylowinteractive/,69,2022-01-25 05:26:59
Augmented E-commerce Solution - Alpha Soft,"Alpha Soft offers AR solutions for projects of all genre and industry, ... WHAT ARE YOUR DELIVERABLES AS THE BEST AR/VR DEVELOPMENT COMPANY IN BANGLADESH?",https://alphasoftbd.com/our-service/ar-vr-development/augmented-e-commerce-solution/,70,2022-01-25 05:26:59
AR/VR App and Game Development Company US ... - Folio3,Folio3's team of expert AR/VR developers develops Smart and Scalable AR App with stunning and immersive experiences for your users.,https://www.folio3.com/mobile/augmented-reality-app-development-vr-app-development/,71,2022-01-25 05:26:59
The Next Best Thing to Being There | by Pritthijit (Raja) Kundu,"May 8, 2018 — Yes, I am talking about VR — Virtual Reality! ... Rupshi, Narayanganj District, Bangladesh (Photo Credit: Pritthijit (Raja) Kundu).",https://arvrjourney.com/the-next-best-thing-to-being-there-8e9f56f24007,72,2022-01-25 05:26:59
Virtual Reality and Augmented Reality - MIT xPRO,"According to Forbes, XR technologies, including VR and AR, will be ""one of the most transformative tech trends of the next five years.",https://executive-ed.xpro.mit.edu/virtual-reality-augmented-reality,73,2022-01-25 05:26:59
Augmented and Virtual Reality in Healthcare Market Size ...,"Some of these secondary sources include organizations and associations such as VR/AR Association, AugmentedReality.Org, and Augmented Reality for Enterprise ...",https://www.marketsandmarkets.com/Market-Reports/augmented-reality-virtual-reality-healthcare-market-220832469.html,74,2022-01-25 05:26:59
"AR, VR: A different World! - EMK Center - Stay Happening","Dec 15, 2021 — AR, VR: A different World! at EMK Center, Midas Center Building (9th Floor) House-5, Road-16, Dhanmondi, Dhaka–1209, Bangladesh., Dhaka, ...",https://stayhappening.com/e/ar-vr-a-different-world-E2ISU4WY5YX,75,2022-01-25 05:26:59
VR Conference - bishwobiddaloy.com,"Sep 26, 2019 — Bangladesh Innovation Forum is going to organize VR Conference on 8th ... There will be 16 Seminar about AR, VR, MR & Gaming, Hackathon, ...",https://www.bishwobiddaloy.com/archives/2008,76,2022-01-25 05:26:59
Virtual and Augmented Reality: Pros and Cons - Encora,"The following are some key points to keep in mind regarding VR/AR. Virtual Reality. Pros: VR, when implemented properly, can be an incredibly engaging sensory ...",https://www.encora.com/insights/virtual-and-augmented-reality-pros-and-cons,77,2022-01-25 05:26:59
VR First - Democratizing VR/AR Innovation,VR First is a global program designed to provide state-of-the-art facilities to creators and educators interested in exploring the power and potential of ...,https://www.vrfirst.com/,78,2022-01-25 05:26:59
AR & VR Learning: Data Requirements That Enable Effective ...,"Nov 10, 2021 — What L&D data is most relevant for AR and VR training simulations? We explore the data you need for learning analytics and the questions to ...",https://www.watershedlrs.com/blog/learning-data-ecosystems/ar-vr-learning-data-requirements-effective-reporting/,79,2022-01-25 05:26:59
Augmented Reality (AR) & VR App Development - L&T ...,"An AR product configurator & visualizer designed for a manufacturer.. ... Although augmented and virtual reality were merely science fiction in the past, ...",https://www.ltts.com/services/augmented-reality-app-development,80,2022-01-25 05:26:59
Reality Labs - Facebook Technology,"While modern-day VR headsets fully immerse people in 3D virtual environments, ... Meta operates five research facilities around the world to drive AR/VR ...",https://tech.fb.com/ar-vr/,81,2022-01-25 05:26:59
University Creating 20000 AR/VR Lessons - Campus ...,"Apr 7, 2020 — Over the next two months, Kosovo's University for Business and Technology will be using the EON Reality platform to create 20000 ...",https://campustechnology.com/articles/2020/04/07/university-creating-20000-ar-vr-lessons.aspx?admgarea=news,82,2022-01-25 05:26:59
AR/VR Development Services - Tekki Web Solutions Pvt. Ltd.,Add Value your Business with Augmented Reality and Virtual Reality. Enhance the real-world experience and interactions with our fantastic AR/VR consulting ...,https://www.tekkiwebsolutions.com/ar-vr/,83,2022-01-25 05:26:59
Top 10 Augmented/Virtual Reality (AR/VR) Schools on the ...,"Nov 8, 2021 — Our 2021 list of the Top 10 AR/VR Programs in the West. For an explanation of our ranking criteria, click here. 1. Stanford University, Stanford ...",https://www.animationcareerreview.com/articles/top-10-augmentedvirtual-reality-arvr-schools-west-coast-2021-college-rankings,84,2022-01-25 05:26:59
AR & VR Headsets Market Share - IDC,"Dec 20, 2021 — New Products and Improved Supply Drive Growth in AR/VR Headset Shipments. Global Shipments of AR and VR headsets 348.4% over last year.",https://www.idc.com/promo/arvr,85,2022-01-25 05:26:59
"Software Engineers (Unity, AR/VR) - TigerIT Bangladesh Ltd ...","We are looking forward to hiring two Software Engineers (Unity, AR/VR) for our team at Tiger IT Bangladesh Ltd. You can apply If you have over three years ...",https://bd.jobkowi.com/view/635586/software-engineers-unity-ar-vr,86,2022-01-25 05:26:59
Four AR/VR Developments Involving Antennas - Experience ...,"In their quest to take devices and systems to the next level, augmented reality/virtual reality (AR/VR) designers put most of their efforts into content ...",https://experience.molex.com/four-ar-vr-developments-involving-antennas/,87,2022-01-25 05:26:59
AR/VR Classroom Pack - RobotLAB,"Jul 11, 2019 — Bring your lessons to life with virtual reality. Spark curiosity and engage the entire classroom with the RobotLAB AR/VR.",https://www.robotlab.com/store/ar-vr-classroom-pack,88,2022-01-25 05:26:59
Gear Up for the Holidays With AR and VR - Gartner,"Nov 17, 2020 — As the holidays near, leading marketers look to advanced technologies, such as augmented reality (AR) and virtual reality (VR), to enhance ...",https://www.gartner.com/en/marketing/insights/daily-insights/gear-up-for-the-holidays-with-ar-and-vr,89,2022-01-25 05:26:59
"A Survey of Augmented Reality Technologies, Applications ...","by DWF van Krevelen · 2010 · Cited by 2117 — 1), AR is one part of the general area of mixed reality. Both virtual environments (or virtual reality) and augmented virtuality, in which real objects are ...",https://ijvr.eu/article/view/2767/8825,90,2022-01-25 05:26:59
Unity (UCU) Practice test - Certify Bangladesh,"Description. Unity is the leading content-creation platform for VR/AR, real-time 3D, and mobile 2D. Unity is used by students and professionals around the ...",https://certifybangladesh.com/product/unity-ucu-practice-test/,91,2022-01-25 05:26:59
Building AR/VR Applications in the Browser - InfoQ,"Aug 5, 2019 — Both Augmented and Virtual reality present exciting new opportunities for web developers. We follow Doug Sillars' talk on ""Building an ARt ...",https://www.infoq.com/news/2019/08/javascript-ar-vr-applications/,92,2022-01-25 05:26:59
Microsoft HoloLens: Bringing AR & VR Together - Flatworld ...,Augmented Reality (AR) and Virtual Reality (VR) are among the technology buzzwords which are making news headlines lately. With a broad spectrum of applications ...,https://www.flatworldsolutions.com/IT-services/articles/microsoft-hololens-bringing-AR-VR-together.php,93,2022-01-25 05:26:59
AR and VR in the workplace | IBM,"Sep 23, 2020 — XR technologies include augmented reality (AR), virtual reality (VR), and. XR enables efficiency amidst disruption. Companies across industries ...",https://www.ibm.com/thought-leadership/institute-business-value/report/ar-vr-workplace,94,2022-01-25 05:26:59
GoodFirms Highlights the List of Best AR/VR Companies for ...,"Nov 29, 2021 — It has pushed businesses to implement the latest technologies like Augmented Reality (AR) and Virtual Reality (VR). Today various sectors are ...",https://www.einnews.com/pr_news/557269321/goodfirms-highlights-the-list-of-best-ar-vr-companies-for-manufacturing-sports-and-architect-industry-2021,95,2022-01-25 05:26:59
Using Augmented Reality To Fight World Hunger | ARPost,"Jun 19, 2019 — Viewers went on a journey to three different countries: South Sudan, Jordan, and Bangladesh. Through the AR platforms, viewers could see the ...",https://arpost.co/2019/06/19/augmented-reality-world-hunger/,96,2022-01-25 05:26:59
Apple's AR/VR headset may launch as early as next year,"Dec 19, 2021 — Apple is working on the most advanced chips for its unannounced AR/VR headset and now a new report has claimed that the headset could be in ...",https://www.business-standard.com/article/technology/apple-s-ar-vr-headset-may-launch-as-early-as-next-year-report-121121900099_1.html,97,2022-01-25 05:26:59
Facebook announces name change to Meta in rebranding effort,"Oct 29, 2021 — Zuckerberg revealed the new name at Facebook's annual AR/VR ... such as Instagram and WhatsApp, and the virtual reality brand Oculus.",https://m.theindependentbd.com/post/269661,98,2022-01-25 05:26:59
What are Bangladeshi artists saying about NFT? | The Daily Star,"Jan 6, 2022 — NFT stands for non-fungible token. Simply put, it's a unique digital token that can't be reproduced or replaced. NFTs can be anything – digital ...",https://www.thedailystar.net/shout/news/what-are-bangladeshi-artists-saying-about-nft-2932411,0,2022-01-25 05:27:03
NFT Bangladesh - Home | Facebook,We are trying to introduce NFT into Bangladesh market. NFT or non-fungible token is a unique and non-interchangeable unit of data stored on a digital ledger ...,https://www.facebook.com/NFTBangladesh,1,2022-01-25 05:27:03
The Bangladesh - New World Money NFT Collection | OpenSea,"The Bangladesh · This is the Bangladeshi edition of the New World Money NFT Collection. ; schedule. Sale ends June 24, 2022 at 12:58pm PST ; Created by BukBlac.",https://opensea.io/assets/0x495f947276749ce646f68ac8c248420045cb7b5e/85906710067980936081454483355048052006638553716198814326890970026662493683713,2,2022-01-25 05:27:03
Beauty of Bangladesh statistics - NFT Stats,Beauty of Bangladesh is a NFT (Non-fungible token) collection. A collection of digital artwork stored on the blockchain. ▷ How many Beauty of Bangladesh tokens ...,https://www.nft-stats.com/collection/beauty-of-bangladesh,3,2022-01-25 05:27:03
Ashraful Arefin | My Everyday Magic - Crypto.com NFT,"Ashraful Arefin is a fine art photographer from Dhaka, Bangladesh. His Harry Potter and Alice in Wonderland inspired animations & cinemagraphs have caught ...",https://crypto.com/nft/drops-event/3c9b224c283e43f5a376a5526743426d,4,2022-01-25 05:27:03
NFT BANGLADESH in 2022 - Pinterest,"Jan 6, 2022 - This Pin was discovered by NFT. Discover (and save!) your own Pins on Pinterest.",https://www.pinterest.com/pin/nft-bangladesh-in-2022--915286324240418784/,5,2022-01-25 05:27:03
What are NFTs and how are artists making millions selling ...,"Apr 11, 2021 — Instead, they obtained a unique digital token known as an NFT. ... The Bangladesh government for instance has stated in 2019 that they are ...",https://www.tbsnews.net/feature/panorama/what-are-nfts-and-how-are-artists-making-millions-selling-them-230002,6,2022-01-25 05:27:03
Can somone from Bangladesh sell NFT? If yes then how?,"May 14, 2021 — Thank you for your submission on r/NFT, join us on Discord for live discussion on everything NFTs, and to share & buy/sell your NFTs!",https://www.reddit.com/r/NFT/comments/nc1acg/can_somone_from_bangladesh_sell_nft_if_yes_then/,7,2022-01-25 05:27:03
BD crypto - Binance NFT,"Welcome to the Binance NFT Marketplace owned and operated by Hash Muse Pte Ltd, whose address is at 531A Upper Cross Street, #04-95 Hong Lim Complex, ...",https://www.binance.com/en/nft/goods/detail?productId=4744624&isProduct=1,8,2022-01-25 05:27:03
Bangladesh | NFT on Solsea,"Bangladesh. GDP. $350 billion. Region. Asia. Nation NFT Number. 40. Population. 164 million. GDP Per Capita. $2 thousand. Anthem: ""Amar Sonar Bangla"" (""My ...",https://solsea.io/nft/8NwHAW24jHcdZ9VkqU3mMXKFCtXtMyLTtABeD2dvQVJN,9,2022-01-25 05:27:03
"NFT craze explained: What is it, why is it so popular and how ...","Dec 28, 2021 — ... first-ever century in the 2003 ODI match against Bangladesh in Dhaka. People have spent over $9 billion in NFT sales so far—and total ...",https://timesofindia.indiatimes.com/business/india-business/nft-craze-explained-what-is-it-why-is-it-so-popular-and-how-to-they-work/articleshow/88541929.cms,10,2022-01-25 05:27:03
Khandaker Ahsanuzzaman - Managing Director - NFT ...,"Managing Director. NFT Bangladesh. Dec 2020 - Present1 year 2 months. Dhaka, Bangladesh. A concern of NFT Group specialised in tower cranes.Discord NFT server Promoter, Freelance at Upwork ... Syed Munsiv Alam Rakin. Medical Documentation Specialist at Augmedix Bangladesh. Khulna, Bangladesh ...",https://bd.linkedin.com/in/khandaker-ahsanuzzaman-72086594,11,2022-01-25 05:27:03
I'm Helpless When I'm Oceans Away (NFT diptych) (2020) | Artsy,"From Tara Digital Collective, BD White, I'm Helpless When I'm Oceans Away (NFT diptych) (2020), NFT.",https://www.artsy.net/artwork/bd-white-im-helpless-when-im-oceans-away-nft-diptych,12,2022-01-25 05:27:03
"most expensive NFTs, Bangladesh economic forecast, Monzo ...","Best of the week: most expensive NFTs, Bangladesh economic forecast, Monzo and Wise partnership. July 9, 2021.",https://payspacemagazine.com/business/best-of-the-week-most-expensive-nfts-bangladesh-economic-forecast-monzo-and-wise-partnership/,13,2022-01-25 05:27:03
BST Time to NFT Time Converter - datetime360.com,"Convert BST Time(Bangladesh Standard Time,UTC + 06:00) to NFT(Norfolk Time,UTC + 11:00) Time. World Clock, Time Conversion, Calculator and Mapping Table.",https://datetime360.com/bst-bangladesh-nft-time/,14,2022-01-25 05:27:03
Convert NFT to Bangladesh taka - Cryptocurrency exchange ...,"Currency converter NFT Bangladesh taka ... Today, you can convert 10 NFT for 117.16 Bangladesh taka. Today 25 NFT = 292.91 BDT. You can sell 50 NFT for 585.82 ...",https://www.cryptoratesxe.com/convert-nft-to-bangladesh-taka.html,15,2022-01-25 05:27:03
NFT Group (@nft_group) • Instagram photos and videos,"... 46 Following, 139 Posts - See Instagram photos and videos from NFT Group (@nft_group) ... Photo by NFT Group in Dhaka, Bangladesh with @comansacranes, ...",https://www.instagram.com/nft_group/?hl=en,16,2022-01-25 05:27:03
Emilio - Digital Artist (Cardano Versus The Empire) - Nfthubs.io,"If you like my art and purchase one of my NFTs, perhaps also included an NFT of ... These NFTs are created on location and Bangladesh and 100% of the ...",https://www.nfthubs.io/collections/emilio-digital-artist-cardano-versus-the-empire,17,2022-01-25 05:27:03
NFT to BST (Bangladesh) - SitesWorld,Norfolk Time to Bangladesh Standard Time conversion tables for all given world clock times in 24 hours (GMT 11.5 to GMT 6.),https://www.sitesworld.com/time/nft-to-bst-(bangladesh).html,18,2022-01-25 05:27:03
"Melania to auction off hat, NFT from Macron visit - New Age","Jan 5, 2022 — New Age, a Dhaka-based leading English language daily newspaper, is a major source of news of Bangladesh and international affairs.",https://www.newagebd.net/article/159196/melania-to-auction-off-hat-nft-from-macron-visit,19,2022-01-25 05:27:03
Bangladesh National Flag - Mint Space NFT Marketplace,Is this item authentic? Verify. Description; Reviews (0); Vendor Info; More from Vendor. Description. National Flag of Bangladesh ...,https://mintspace.io/product/bangladesh-national-flag/,20,2022-01-25 05:27:03
LTD.INC announces launch of Web3 platform and mobile app,"Jan 3, 2022 — INC leverages NFTs and the Ethereum blockchain to authenticate ... FTA with the UK help India take on competition from Bangladesh, Vietnam?",https://m.economictimes.com/markets/cryptocurrency/ltd-inc-announces-launch-of-web3-platform-and-mobile-app/articleshow/88661090.cms,21,2022-01-25 05:27:03
NFT Protocol to BDT Chart (NFT/BDT) | CoinGecko,Get live charts for NFT to BDT. Convert NFT Protocol (NFT) to Bangladeshi Taka (BDT).,https://www.coingecko.com/en/coins/nft-protocol/bdt,22,2022-01-25 05:27:03
Block Duelers NFT Battles Price (BDT) - CoinMarketCap,"Get the latest Block Duelers NFT Battles price, BDT market cap, trading pairs, charts and data today from the world's number one cryptocurrency ...",https://coinmarketcap.com/currencies/block-duelers/,23,2022-01-25 05:27:03
Filing history for NFT BD LIMITED (12534168) - Companies ...,"NFT BD LIMITED - Free company information from Companies House including registered office address, filing history, accounts, annual return, officers, ...",https://find-and-update.company-information.service.gov.uk/company/12534168/filing-history,24,2022-01-25 05:27:03
Liza A. - Discord promoter /NFT Discord Expert - Upwork,"Upwork Freelancer Liza A. is here to help: Discord promoter /NFT Discord Expert. ... verified name if you enter into a contract together. khulna, Bangladesh ...",https://www.upwork.com/freelancers/~0108b3b4e5afac629c/,25,2022-01-25 05:27:03
International Cricket NFTs to Hit Flow Blockchain Following ...,"Nov 3, 2021 — ... West Indies and Bangladesh at Sharjah Cricket Stadium on Oct. 29, 2021, ... It's not the first cricket NFT platform to hit the market.",https://www.coindesk.com/business/2021/11/03/international-cricket-nfts-to-hit-flow-blockchain-following-17m-seed-round/,26,2022-01-25 05:27:03
The NFT Ltd - Crunchbase Company Profile & Funding,"The NFT Ltd.World leader in NFT news podcast. ... While NFTs, or non-fungible tokens, remained fairly niche for several ... Private Bangladesh Companies.",https://www.crunchbase.com/organization/the-nft-ltd,27,2022-01-25 05:27:03
Ashraful Arefin | The NFT Agency,"Ashraful Arefin is a fine art photographer born on May 3rd in Dhaka, Bangladesh, and currently based in the same city. Ashraful was always very interested ...",https://www.thenftagency.com/ashraful-arefin,28,2022-01-25 05:27:03
"Convert 1 NFT to BDT, How Much is 1 NFT in Bangladeshi Taka","Convert 1 NFT to BDT, How Much is 1 NFT in Bangladeshi Taka ; Convert another value (NFT to BDT): NFT ...",https://www.cryptocurrency724.com/convert-1-nft-to-bdt.html,29,2022-01-25 05:27:03
NorfolkIsland (NFT) to Bangladesh (BST) - Global Time ...,"Nov 28, 2021 — NorfolkIsland (NFT) to Bangladesh (BST). Bangladesh is 5 hour behind of NorfolkIsland. NorfolkTime. Current Time. 11:00:05 AM. Current Date.",https://globaltimeconverter.com/timeconvert/timezone/NorfolkIsland/Bangladesh,30,2022-01-25 05:27:03
GameStop is building an NFT marketplace - Yahoo News ...,"Jan 10, 2022 — Gaming retailer GameStop is launching a division specifically dedicated to profiting from the sale of gaming NFTs and other cryptocurrencies ...",https://sg.news.yahoo.com/gamestop-building-nft-marketplace-165256258.html,31,2022-01-25 05:27:03
The Coming Convergence of NFTs and Artificial Intelligence,"Oct 25, 2021 — Non-fungible tokens (NFT) are becoming one of the most important trends in the crypto ecosystem. The first generation of NFTs has focused on ...",https://www.nasdaq.com/articles/the-coming-convergence-of-nfts-and-artificial-intelligence-2021-10-25,32,2022-01-25 05:27:03
"Non-FungibleTony (NFT) on Twitter: ""gm and bd DeeBo says ...","Non-FungibleTony (NFT). @tonyherrera. gm and bd DeeBo says ""hello"" to all of you. :) Image. 5:52 PM · Dec 19, 2021·Twitter for Android.Vietnam, India, Indonesia and Bangladesh are the most active countries participating in Ftribe Fighters Massive #Airdrop. Our #AIRDROP will finish on Dec ...",https://mobile.twitter.com/tonyherrera/status/1472625907542081539,33,2022-01-25 05:27:03
"Artnet: Buy, Sell, and Research Contemporary Art Online","Artnet is the art world online. Find artworks for sale, online auctions, top galleries, leading artists, and breaking art market news from around the globe.",http://www.artnet.com/,34,2022-01-25 05:27:03
Buff Doge NFT (BD) Token Tracker | Etherscan,"Buff Doge NFT (BD) Token Tracker on Etherscan shows the price of the Token $0.00, total supply 78, number of holders 57 and updated information of the token ...",https://etherscan.io/token/0xfe5737be28af719a9fcd8abf37f52234dd6cbb8f?a=0x7975d12757a72bf2dc02dc25c9dc015b9c5bff1f,35,2022-01-25 05:27:03
Enter a search term or a topic - Google Trends,Explore how Google data can be used to tell stories. featured. Year in Search 2021. Explore the year through the lens of Google Trends data.,https://trends.google.com/trends/?geo=HK,36,2022-01-25 05:27:03
"NFT to BDT (Nft to Bangladeshi Taka) | convert, exchange rate",NFT to BDT online converter. See how much your amount is NFT (Nft) now in BDT (Bangladeshi Taka). ✓ Tested by the users.,https://www.cryps.info/en/NFT_to_BDT/,37,2022-01-25 05:27:03
"Latest news update from NFT Inc in Bangladesh, World","Latest NFT Inc news in Bangladesh. ... The NFT vehicle with a projected price tag of $50,000 will function as a car, but be able to take.",https://archive.dhakatribune.com/hashtag/nft-inc,38,2022-01-25 05:27:03
"Yuvraj Singh bat flies to space, becomes first minted NFT ever ...","Dec 26, 2021 — Colexion launched satellite NFTs carrying prized possessions of the Indian ... century in the 2003 ODI match against Bangladesh in Dhaka.",https://www.livemint.com/technology/yuvraj-singh-bat-flies-to-space-becomes-first-minted-nft-ever-to-sent-in-orbit-11640488202179.html,39,2022-01-25 05:27:03
Nft scholarship – Nft scholarship,"to poor students and unemployed young through gaming. Primarily, our program running 8 countries( Venezuela, Indonesia, Pakistan, Bangladesh, Nepal, Thailand, ...",https://nftscholarship.org/,40,2022-01-25 05:27:03
Dog-374-BD... NFT for sale at Mintable.app,Trade NFTs faster and without any fees with Immutable X! Click Here to learn more. Home; unknown; undefined #undefined. share. Seller. undefined. Store.,https://mintable.com/collectibles/item/Dog-374-BD/createstore,41,2022-01-25 05:27:03
What's next move of Nike after acquiring NFT fashion start-up ...,Subscribe Now! ... AO BANGLADESH December 2021 ... Your insight into the world of the movers and shakers of the Bangladesh manufacturing industry. We also talk ...,https://apparelresources.com/technology-news/retail-tech/whats-next-move-nike-acquiring-nft-fashion-start-rtfkt/,42,2022-01-25 05:27:03
Home Page - Bombcrypto,4570/5000 0xea3516feb8f3e387eec3004330fd30aff615496a 13679910 NFT Infomation Bhero Sold BHouse Sold ... NFT ITEMS Earn your NFT items by playing the,https://bombcrypto.io/,43,2022-01-25 05:27:03
Buy NFTs - The Adoption,"We are very proud to have collaborators from Ghana, Malaysia, United States, Bangladesh, Canada, France, Singapore, United Kingdom, Italy, Ukraine and Haiti ...",https://www.theadoption.io/nft,44,2022-01-25 05:27:03
Converti APENFT in Taka del Bangladesh (NFT in BDT),"Converti facilmente APENFT in Taka del Bangladesh con il nostro convertitore di criptovalute. 1 NFT ha attualmente un valore di 0,00024706 BDT.",https://www.coinbase.com/it/converter/nft/bdt,45,2022-01-25 05:27:03
Thousands of Rohingya shops demolished in Bangladesh ...,"Jan 4, 2022 — Bangladesh praised for taking in nearly a million Rohingya refugees, but destruction of shops that serve communities has attracted ...",https://www.theguardian.com/world/2022/jan/05/thousands-of-rohingya-shops-demolished-in-bangladesh-leaving-refugees-desperate,46,2022-01-25 05:27:03
Melania Trump launches new NFT venture - The Asian Age,"Dec 18, 2021 — Former US first lady Melania Trump has launched her non-fungible token (NFT) and blockchain technology venture, joining a growing list of ...",https://dailyasianage.com/news/278247/melania-trump-launches-new-nft-venture,47,2022-01-25 05:27:03
ROOF Tower Corner NFT Structure Full Package,"Sold by: Inhouse product ; Sold By. www.technopower.com.bd ; Model · AGHC06 ; Address: 2/2 Rk Mission Road Dhaka, Dhaka Division, Bangladesh ; Phone: 01674-368628, ...",https://www.technopower.com.bd/product/roof%20tower%20corner%20nft%20structure%20full%20package,48,2022-01-25 05:27:03
Nft sales bot,The sales of major non-fungible token (NFT) marketplaces increased by +40% ... Step 1: To receive alerts on sale of NFTs from the bot on a the community ...,https://megatite.com/olfgtb/nft-sales-bot.html,49,2022-01-25 05:27:03
Jashore University of Science and Technology - Wikipedia,"Jashore University of Science and Technology also known as JUST (Bengali: যবিপ্রবি) is a government-financed public university in Bangladesh. ... In 2009, JUST added Nutrition & Food Technology (NFT), ...",https://en.wikipedia.org/wiki/Jashore_University_of_Science_and_Technology,50,2022-01-25 05:27:03
Faculty - NFT - Nutrition and Food Technology,"dr. md. omar faruque. Associate Professor. PhD ; dr. shireen nigar. Associate Professor & Chairman, Dept. of NFT ( Founder Provost of Bir Pratik Taraman Bibi ...",https://nft.just.edu.bd/people/faculty,51,2022-01-25 05:27:03
Google Trends,"You are using unsupported browser. Some features may not work correctly. Upgrade to a modern browser, such as Google Chrome.Trends has upgraded to a newer ...",https://www.google.com/trends/home/h/US,52,2022-01-25 05:27:03
