title,snippet,link,position,date
Ripple Powers Remittance Corridor between Malaysia and ...,"Jan 15, 2021 — Malaysia's Mobile Money wallet will connect directly to Bangladesh's bKash, the largest provider of mobile financial services which serves over ...",https://blockchain.news/news/ripple-powers-remittance-corridor-between-malaysia-bangladesh-ripplenet,81,2022-01-25 05:26:49
"Microsoft's big bet on metaverse, to acquire Activision Blizzard ...","6 days ago — The deal plants Microsoft's flag in the emerging battle for dominance in the so-called metaverse, the next-generation internet that melds ...",https://newsable.asianetnews.com/business/microsoft-big-bet-on-metaverse-to-acquire-activision-blizzard-for-68-7-billion-dnm-r5wsp5,82,2022-01-25 05:26:49
T-Series and HEFTY Entertainment a Division of Hungama ...,15 hours ago — T-Series and HEFTY Entertainment a Division of Hungama Digital Media Announce their Foray into the Metaverse with soon to be Launched NFTs.,https://www.easternherald.com/2022/01/24/t-series-and-hefty-entertainment-a-division-of-hungama-digital-media-announce-their-foray-into-the-metaverse-with-soon-to-be-launched-nfts/,83,2022-01-25 05:26:49
Who Will Own the Metaverse? (And Why Channel Partners ...,"Dec 7, 2021 — Microsoft and Facebook have been collaborating on a number of metaverse-y integrations. The Meta Workplace app, for example, is currently ...",https://rcpmag.com/articles/2021/12/07/who-will-own-the-metaverse.aspx,84,2022-01-25 05:26:49
The Metaverse property sold for a record $ 2.43 million,"Nov 29, 2021 — The acquisition of Metaverse Group is more than double the previous record for the sale of land or property within a virtual reality world.",https://bangladesh.kivazen.com/the-metaverse-property-sold-for-a-record-2-43-million/,85,2022-01-25 05:26:49
Unraveling the Metaverse - Fabric,"Nov 27, 2021 — The metaverse in not limited to VR+AR+Blockchain, although it includes all of those. Because the metaverse is not a technological construct. It ...",https://www.fabricbd.com/perspectives/what-is-the-metaverse,86,2022-01-25 05:26:49
Does the Metaverse need restrictive regulation? | Ctech,"Dec 4, 2021 — (West Virginia Bd. of Ed. v. Barnette, 319 U.S. 624 (1943)). And, if platforms had limited ability to censor, the Metaverse would become a ...","https://www.calcalistech.com/ctech/articles/0,7340,L-3924060,00.html",87,2022-01-25 05:26:49
What is the Metaverse? - SwissBorg,"Dec 1, 2021 — Curious about the Metaverse, how it relates to crypto and what it might mean for the future? Find out more here!",https://swissborg.com/blog/what-is-metaverse,88,2022-01-25 05:26:49
BD Innovation Profiled in Cover Story of 'Science ...,"4 days ago — BD (Becton, Dickinson and Company) (NYSE: BDX), a leading global medical technology company, today announced that a study conducted in ...",https://www.yahoo.com/now/bd-innovation-profiled-cover-story-190100729.html,89,2022-01-25 05:26:49
Metaverse Will Change Virtual World of the Internet - TrickB.Com,TrickB.Com - Bangla Tech News Publisher ... Metaverse is a virtual world where you are going to have a different kind of experience.,https://www.trickb.com/2022/01/metaverse-will-change-virtual-world-of.html,90,2022-01-25 05:26:49
IggyBoy NFTs are becoming the main driving force for ...,"8 hours ago — January 22, 2021. 'Metaverse' and 'NFT' keywords are becoming the most trending ones in 2022. These are still inscrutable notions for the ...",https://www.bignewsnetwork.com/news/272226835/iggyboy-nfts-are-becoming-the-main-driving-force-for-metaverse,91,2022-01-25 05:26:49
The truth about Facebook's 'metaverse' - The Spectator World,"Sep 29, 2021 — ... 'metaverse' — a virtual reality world, or virtual reality worlds. ... speak to people in Britain, Bhutan and Bangladesh simultaneously.",https://spectatorworld.com/topic/truth-about-facebook-metaverse/,92,2022-01-25 05:26:49
S. Korea to offer $100m in loans for Bangladesh's economic ...,"Nov 15, 2021 — ... joint project to support Bangladesh's economy, the finance ministry said. ... Korea aims to become 5th-largest metaverse market by 2026.",http://www.koreaherald.com/view.php?ud=20211115000676,93,2022-01-25 05:26:49
The Metaverse Won't Fix Facebook - Forrester,"Oct 25, 2021 — Facebook continues to battle strong headwinds. As the company eyes the metaverse, consumers want substantive changes to Facebook's ...",https://www.forrester.com/blogs/the-metaverse-wont-fix-facebook/,94,2022-01-25 05:26:49
The truth about Facebook's 'metaverse' | The Spectator,"Sep 29, 2021 — ... speak to people in Britain, Bhutan and Bangladesh simultaneously. ... A brain-mangling virus ends up being spread through the Metaverse.",https://www.spectator.co.uk/article/the-truth-about-facebook-s-metaverse-,95,2022-01-25 05:26:49
"Asia's tech news #110: Blockchain in India, Baidu's metaverse ...","Nov 21, 2021 — Asia's tech news, issue 110: Blockchain in India, Baidu's metaverse moves, Bangladesh's startups, entrepreneur wellness in Australia, ...",https://wkwright.medium.com/asias-tech-news-110-blockchain-in-india-baidu-s-metaverse-bangladesh-s-startups-b812245dd337?source=post_internal_links---------5-------------------------------,96,2022-01-25 05:26:49
UserTesting Intro Capabilities for Testing Metaverse and VR ...,"23 hours ago — UserTesting, a leader in video-based human insight, has released new templates for its Human Insight Platform that enable.",https://www.thefastmode.com/technology-solutions/22591-usertesting-intro-capabilities-for-testing-metaverse-and-vr-experiences,97,2022-01-25 05:26:49
Top Virtual Reality Companies in Bangladesh 2022 | GoodFirms,"List of AR/VR Companies in Bangladesh | Top AR Developers in Bangladesh ; Azmi Studio. Game, Simulator, AR, VR, MR & Apps Dev Company · < $25/hr ; IM Digital.",https://www.goodfirms.co/augmented-virtual-reality/bangladesh,0,2022-01-25 05:26:59
AR and VR - Bangladesh Venture Capital,"Augmented reality (AR) involves overlaying visual, auditory, or other sensory information onto the world in order to enhance one's experience. What is VR?",https://venture.com.bd/ar-and-vr/,1,2022-01-25 05:26:59
"AR, VR, MR, XR, 360 Solutions - Riseup Labs","Our finest Augmented Reality (AR), Virtual Reality (VR), Mixed Reality (MR) ... It's a Fast-Paced AR, VR, MR, XR, 360 Development Company in Bangladesh.",https://riseuplabs.com/ar-vr-mr-solutions/,2,2022-01-25 05:26:59
Top AR & VR Providers in Bangladesh | Brain Station 23,"Apr 16, 2020 — Top AR VR solution Providers in Bangladesh · Brain Station 23 · Dreamerz Lab · Battery Low interactive · Rise Up Labs · Datasoft · Techno Magic · KAZ ...",https://brainstation-23.com/top-ar-vr-providers-in-bangladesh/,3,2022-01-25 05:26:59
Top 10+ AR/VR Development Companies in Bangladesh (2021),Explore Top AR/VR Development Companies in Bangladesh ; Brain Station 23 Limited · 250-999 · $150-250/h · Custom Software Development ; Kaz Software Limited · 50-249.,https://techbehemoths.com/companies/ar-vr-development/bangladesh,4,2022-01-25 05:26:59
AR/VR Solution Provider in Bangladesh | Dcastalia,"At Dcastalia, we offer a wide selection of solutions across industries in the space of AR, VR with expertise in computer vision, machine learning, ...",https://dcastalia.com/arvr-solution,5,2022-01-25 05:26:59
Top AR & VR Solution Provider in Bangladesh - Azmi Studio,Looking for AR / VR development company? We are an Augmented & Virtual Reality App Development Company in Bangladesh building AR/VR apps as per client ...,https://azmistudio.com/ar-vr-development/,6,2022-01-25 05:26:59
Top 10 AR VR Development Company in Bangladesh - Cloodo,"To assist you in your search for a partner, we've compiled this list of the AR VR Development in Bangladesh. Browse their ageny profile descriptions, their ...",https://cloodo.com/bangladesh/ar-vr-development,7,2022-01-25 05:26:59
Augmented & Virtual Reality | DHL | Bangladesh,"Augmented and virtual reality (AR/VR) technology has experienced generally slow adoption and spread across industries, including the logistics industry.",https://www.dhl.com/bd-en/home/insights-and-innovation/thought-leadership/trend-reports/augmented-reality.html,8,2022-01-25 05:26:59
The prospects of augmented and virtual reality in the ...,"Aug 6, 2021 — Brain Station 23, a leading software development company in Bangladesh, is one such company that develops platform-independent AR, VR, ...Jun 24, 2021 — The VR/AR gaming phenomenon in Bangladesh is relatively new and will take time to expand. Wide-scale adoption of VR in organisations in the ...",https://thefinancialexpress.com.bd/health/the-prospects-of-augmented-and-virtual-reality-in-the-healthcare-sector-1628255764,9,2022-01-25 05:26:59
EMK opens AR-VR lab - The Business Standard,"Nov 4, 2021 — EMK Center has established the augmented reality and virtual reality laboratory to support Bangladeshi youth to embark on their journey to ...",https://www.tbsnews.net/bangladesh/education/emk-opens-ar-vr-lab-325234,10,2022-01-25 05:26:59
Altered perception | Dhaka Tribune,"Jun 5, 2021 — Given that the augmented and virtual reality (AR/VR) market is set to ... Bangladesh's current population includes some 80 million strong ...",https://archive.dhakatribune.com/business/economy/2021/06/05/altered-perception,11,2022-01-25 05:26:59
These are the Top Virtual Reality Companies in Bangladesh ...,"Feb 1, 2021 — Top Bangladesh Virtual Reality Companies ... We have developed the “1952” app, a history-based educational Augmented Reality (AR) app on the ...",https://welpmagazine.com/these-are-the-top-virtual-reality-companies-in-bangladesh-2021/,12,2022-01-25 05:26:59
Education System for Bangladesh Using Augmented Reality ...,"Jun 22, 2021 — Education System for Bangladesh Using Augmented Reality, Virtual Reality and ... several AR and VR based applications available currently.",https://www.researchgate.net/publication/352579907_Education_System_for_Bangladesh_Using_Augmented_Reality_Virtual_Reality_and_Artificial_Intelligence,13,2022-01-25 05:26:59
Bangladesh Innovation Forum - New Opportunities using AR /VR ...,"Bangladesh Innovation Summit 2020 Session Name- ""New Opportunities using AR /VR/Gaming in COVID time"" Speaker: Tanvir Hossain Khan Founder & CEO at...",https://en-gb.facebook.com/ictinnovationforum/videos/new-opportunities-using-ar-vrgaming-in-covid-time/744432122624522/,14,2022-01-25 05:26:59
Dreamerz Lab Limited - Japandesk,Virtual Reality App; Augmented Reality App; Mobile Game Development; VR Game ... BMW Bangladesh AR/VR Solution; Mithshubishi AR; Berger Paint VR Solution ...,https://japandesk.basis.org.bd/member-profile/dreamerz-lab-limited,15,2022-01-25 05:26:59
3D animation and Virtual Reality at its best - Technomagic,"SPECIAL PROJECTS FOR SPECIAL CLIENTS. All; Animation; AR,VR SOLUTION; architectura visualization; GAMES ... HappyTap Bangladesh Ltd Necessity of Hand wash.",https://www.technomagicbd.com/our-work/,16,2022-01-25 05:26:59
Turzo Khan - Information Technology Specialist - Within (VR/AR),"Turzo Khan. Information Technology Specialist at Within (VR/AR). Within (VR/AR). Dhaka, Dhaka, Bangladesh. Join to Connect · Report this profile ...",https://bd.linkedin.com/in/turzo-khan-7247491a5,17,2022-01-25 05:26:59
XR Community Bangladesh Meets SuperWorld - Dreamerz Lab,"XR Community Bangladesh, XRCB in short is a platform for creating awareness and promoting the discourse on AR, VR & MR which falls under the ...",https://dreamerzlab.com/xr-community-bangladesh-meets-superworld/,18,2022-01-25 05:26:59
Augmented Reality / Virtual Reality [AR/VR] | Tech Soft 3D,HOOPS SDKs power world-class AR and VR applications. Import over twenty 3D file formats into your augmented reality (AR) and virtual reality (VR) ...,https://www.techsoft3d.com/markets/ar-vr/,19,2022-01-25 05:26:59
AR VR - Bangla Puzzle,Virtual Reality and Augmented Reality applications change the way of your traditional business approaches. We develop platform-independent AR & VR ...,https://www.banglapuzzle.com/service/ar-vr,20,2022-01-25 05:26:59
AR VR Game and VFX development in Bangladesh - Bugbite ...,"With our skills of making immersive content to connect people, we provide virtual reality solutions for our clients with our VR games and applications. In order ...",https://www.bugbitestudio.com/services/,21,2022-01-25 05:26:59
The State of (Virtual) Reality in College - Dell Technologies,"Immersive technologies - VR, AR and industry-grade tools - empower students to learn by doing. While large universities are increasingly using augmented reality ...",https://www.delltechnologies.com/en-bd/industry/higher-education/the-state-of-vr-in-college-infographic.htm,22,2022-01-25 05:26:59
BD Life Sciences Uses AR To Help Their Field Engineers,"As a leading medical technology company, Becton Dickinson (BD) needed an augmented reality (AR) solution that would help their field engineers and phone ...",https://www.fieldtechnologiesonline.com/doc/bd-life-sciences-uses-ar-to-help-their-field-engineers-0001,23,2022-01-25 05:26:59
Azmi Studio (@azmistudioltd) / Twitter,"We are emerging software development company from Bangladesh providing the best Game, #AR, #VR, #MR solutions to build highly engaging web & mobile ...",https://mobile.twitter.com/azmistudioltd,24,2022-01-25 05:26:59
9 Top Bangladesh Virtual Reality Companies and Startups of ...,"Jun 19, 2021 — Azmi Studio offers a wide range of customized services in mobile game development, animation, AR-VR development sectors. Playense. Devoy Desk.",https://beststartup.asia/9-top-bangladesh-virtual-reality-companies-and-startups-of-2021/,25,2022-01-25 05:26:59
Wonda | The Immersive Storytelling Platform to boost ...,Create your own immersive experiences. Combine any content to make your own VR experience in a couple of minutes.,https://www.wondavr.com/,26,2022-01-25 05:26:59
AR-VR Solution - Best IT Training & Service Provider In ...,AR-VR Solution. Image. Our Details. Premium IT institute provides the best Augmented reality (AR) and Virtual Reality (VR) solution Provider in Bangladesh.,https://www.premiumitinstitute.com/service_des/12,27,2022-01-25 05:26:59
"Md. A. - Software Engineer - Unity, AR/VR, Game, App - Upwork","Upwork Freelancer Md. A. is here to help: Software Engineer - Unity, AR/VR, Game, App. ... name if you enter into a contract together. dhaka, Bangladesh ...",https://www.upwork.com/freelancers/~0148e14ad4756499a8/,28,2022-01-25 05:26:59
AR & VR Based Child Education in Context of Bangladesh,"From that sense, we decide to make a child learning apps by using Augmented Reality & Virtual Reality. AR & VR is the most powerful way of interaction nowadays.",https://saudijournals.com/media/articles/SJEAT_412_514-521.pdf,29,2022-01-25 05:26:59
AR/VR - Star Computer Systems Limited,"We build AR/VR games for Android, iOS as well as for Windows phones. ... it accessible as well as useful to maintain the vowed digitized Bangladesh in 2015.",https://www.stargroup-bd.com/single/solution/details/4,30,2022-01-25 05:26:59
VRCON - 1ST VIRTUAL REALITY CONFERENCE IN ...,,https://www.youtube.com/watch?v=G82__i2Ys8A,31,2022-01-25 05:26:59
AR/VR headsets used with Share&Viz - TechViz,Share&Viz software can display your CAD applications on any AR/VR headsets for a complete immersive experience. The ideal ...,https://www.techviz.net/en/ar-vr-headsets/,32,2022-01-25 05:26:59
Bridging the Vision of a Smarter Tomorrow - DataSoft Systems ...,"In house Virtual Reality Laboratory for R&D, equipped with all major VR and AR platform and equipment set up. Unity 3d ready experienced development team.",http://datasoft-bd.com/bridging-the-vision-of-a-smarter-tomorrow/,33,2022-01-25 05:26:59
EON Reality: Augmented and Virtual Reality Solutions,"Browse our 3D/360 Library. With thousands of detailed 3D assets and 360° environments, you'll have the largest education and training AR and VR library at ...",https://eonreality.com/,34,2022-01-25 05:26:59
Best Augmented Reality Freelancers in Bangladesh | Truelancer,"We have experience with VR, AR, Re-skin replication, technical animation, and all other game development aspects. Xerox Studio is an Indie Game & App Developer.",https://www.truelancer.com/augmented-reality-freelancers-in-bangladesh,35,2022-01-25 05:26:59
New report hints at the potential power of Apple's upcoming ...,All Bangla Latest All News Opera mini Feed Bangladesh ... The first Apple AR/VR headset that we expect to see this year might come with the same charger as ...,http://news.bdtype.com/new-report-hints-at-the-potential-power-of-apple-s-upcoming-ar-vr-headset-512995.html,36,2022-01-25 05:26:59
Augmented & Virtual Reality| Landing Page - Lenovo,"Understand more about the fun and practical uses for AR and VR, and discover the Lenovo products that let you experience both.",https://www.lenovo.com/bd/en/arvr/,37,2022-01-25 05:26:59
Professional Certificate in AR/VR Development and 3D Graphics,Get the skills and knowledge to use AR and VR concepts and 3D graphics programming to develop XR applications.,https://em.online.engineering.nyu.edu/professional-certificate-ar-vr,38,2022-01-25 05:26:59
Dreamerz Lab Ltd. - The VR/AR Directory,"We have been providing solutions to different countries like Bangladesh, India, ... Healthcare & also entertainment industry like mobile game & VR game.",https://thedirectory.thevrara.com/organization/4675,39,2022-01-25 05:26:59
The Benefits of AR/VR as a Marketing Tool - XR Today,"Dec 23, 2021 — What are the benefits of an interactive advertising tool, such as AR/VR or MR? What role will NFTs, the Metaverse and blockchain tech play ...",https://www.xrtoday.com/tv/the-benefits-of-ar-vr-as-a-marketing-tool/,40,2022-01-25 05:26:59
"Law, Virtual Reality, and Augmented Reality - Penn Law ...","by MA Lemley · 2018 · Cited by 108 — Virtual Reality (VR) and Augmented Reality (AR) are going to be big—not ... Two key aspects of this, we will argue, are the Bangladesh problem (which will.",https://scholarship.law.upenn.edu/cgi/viewcontent.cgi?article=9622&context=penn_law_review,41,2022-01-25 05:26:59
Tanvir Hossain Khan - Speaker Profile @ Sessionize.com,Tanvir Hossain Khan is a very known face in Bangladesh ICT industry specially in the sector of AR/VR & Game Development. He has been working in the IC...,https://sessionize.com/tanvir-hossain-khan/,42,2022-01-25 05:26:59
Amplifying Market Penetration Through iToF and AR Technology,"XR (AR/VR/MR) technology will be one of the key technologies in the next decade. At Monstarlab China, we offer innovative AR solutions for creating the most ...",https://monstar-lab.com/bd/cases/amplifying-market-penetration-through-itof-and-ar-technology/,43,2022-01-25 05:26:59
3M Augmented Reality/Virtual Reality Solutions,"The VR experience you've waited for. Finally, an immersive virtual reality experience with a lightweight, thin design. It's possible with 3M's new ARVR ...",https://www.3m.com/3M/en_US/display-solutions-us/solutions/ar-vr/,44,2022-01-25 05:26:59
What Is Extended Reality (XR) and How Is it Changing ... - HP,"Apr 3, 2021 — It rolls together similar acronyms like VR (virtual reality), AR (augmented reality), and MR (mixed reality). Once you know that tidbit, ...",https://www.hp.com/us-en/shop/tech-takes/what-is-xr-changing-world,45,2022-01-25 05:26:59
Augmented Reality for Smarter Bangladesh - IEEE Xplore,by M Riffat · 2020 · Cited by 2 — It is a step between reality and virtual reality. Over the past several years AR technology has become more accessible and is starting to branch out into ...,https://ieeexplore.ieee.org/document/9289699,46,2022-01-25 05:26:59
Introduction to Augmented Reality (AR) Training Course - The ...,Augmented Reality (AR) Training Course in Bangladesh taught by ... Define Augmented Reality; Similarity Between Augmented Reality and Virtual Reality ...,https://www.theknowledgeacademy.com/bd/courses/advanced-technologies-courses/augmented-reality-ar-training/,47,2022-01-25 05:26:59
Top VR Companies & AR Companies - 2021 Reviews - Clutch,"Hire the best AR/VR development firm for your needs. ... Bangladesh, committed to helping worldwide entrepreneurs and business leaders disrupt their ...",https://clutch.co/developers/virtual-reality?page=38,48,2022-01-25 05:26:59
AR/VR Storytelling for Marketing,"Jun 20, 2019 — Discover the four principles for using augmented reality and virtual reality in successful storytelling for your marketing – Content ...",https://contentmarketinginstitute.com/2019/06/ar-vr-stories/,49,2022-01-25 05:26:59
"2022 forecast: AR, VR poised to send medtech into the next ...","Dec 22, 2021 — A recent market research report estimated that between 2021 and 2026, the market for virtual reality in healthcare will grow by nearly 35% ...",https://www.fiercebiotech.com/medtech/reality-check-ar-and-vr-are-poised-to-send-medtech-into-next-dimension-2022,50,2022-01-25 05:26:59
Apple Glasses: Everything we've heard so far | Tom's Guide,"3 days ago — That's because an Apple AR/VR headset is expected first, which is tipped to arrive in late 2022 or early 2023. The Apple Glass would follow ...",https://www.tomsguide.com/news/apple-glasses,51,2022-01-25 05:26:59
XR Technologies and Trends: Pandemic ushers in immersive ...,"Dec 17, 2021 — Though VR and AR are different technologies growing at different rates, the pandemic appears to have galvanized the market for both.",https://www.businessinsider.com/12-17-2021-xr-technologies-immersive-experience-trends-amid-the-pandemic-2021-12,52,2022-01-25 05:26:59
VR Box - VR Headset Price In Bangladesh 2022 - Daraz.com.bd,"5910 items — Best VR Box Price In Bangladesh 2022 at Daraz bd. Shop Online for VR Headset, VR Cardboard, 3D Virtual Reality Glass, VR Box 2. ✓Home Delivery.",https://www.daraz.com.bd/vr-headsets/,53,2022-01-25 05:26:59
Augmented and Virtual Reality in Marketing | AdRoll,"Dec 3, 2021 — The economic impact of augmented and virtual reality is predicted to reach a staggering $29.5 billion in 2020. Is your business ready for AR ...",https://www.adroll.com/blog/augmented-and-virtual-reality-in-marketing,54,2022-01-25 05:26:59
Dreamerz Lab Ltd. (@dreamerzlabltd) • Instagram photos and ...,"Tech Firm || AR, VR Technology ... EXECUTIVE MOTOR BANGLADESH SHOWROOM EXPERIENCE IN VIRTUAL REALITY #4thweek #workinprogress #dreamerzlab #vr.",https://www.instagram.com/dreamerzlabltd/?hl=en,55,2022-01-25 05:26:59
"Azmi Studio- Game, AR, VR Solutions in the city Dhaka","Azmi Studio- Game, AR, VR Solutions in the city Dhaka by the address 20 Sher-E-Bangla Rd, Dhaka 1205, Bangladesh.",https://in.worldorgs.com/catalog/dhaka/software-company/azmi-studio-game-ar-vr-solutions,56,2022-01-25 05:26:59
Azmi Studio | AngelList Talent,"Azmi Studio : Top AR | VR | Animation | Game Development Companies in Bangladesh. View company info, jobs, team members, culture, funding and more.",https://angel.co/company/azmi-studio,57,2022-01-25 05:26:59
Azmi Studio | Software Company in Bangladesh,"AZMI STUDIOS was founded in 2018 and has grown from a game production firm to a full-fledged technological enterprise focused on AR/VR, IoT, AI, and other new ...",https://bdbusinessfinder.com/listing/azmi-studio-software-company-in-bangladesh/,58,2022-01-25 05:26:59
"AR, VR, MR, & MARS","AR, VR, MR, & MARS. Mixed Reality Technologies Supporting Space Exploration. Explore Mars, Inc.'s Mixed Reality Workshop White Paper.",https://www.exploremars.org/ar-vr-mr-mars/,59,2022-01-25 05:26:59
What Is Augmented Reality? | PTC,"Implementing AR technology, industrial enterprises are boosting workforce efficiency and safety, improving operational performance, and lowering costs ...",https://www.ptc.com/en/technologies/augmented-reality,60,2022-01-25 05:26:59
Portfolios - Auleek,AULEEK NOMINATED AS A TOP VR COMPANY OF BANGLADESH BY WELP MAGAZINE ... 5 Great Applications of AR/VR/MR in the AEC Industry.,https://auleek.com/portfolio/,61,2022-01-25 05:26:59
"Azmi Studio, Bangladesh | Sortlist","Azmi Studio is a Bangladeshi software development company headquartered in Dhaka. We provide a wide range of 2D/3D game development, digital reality (AR/VR) ...",https://www.sortlist.com/agency/azmi-studio,62,2022-01-25 05:26:59
TechKnowGram AR VR Solution,"5/9 Block B, Suite B1, Lalmatia, Dhaka 1207, Bangladesh. ... AR (Augmented Reality): TechKnowGram is ... AR / VR Games: TechKnowGram is also releasing.",https://www.techknowgram.com/wp-content/uploads/2021/08/TechKnowGram-AR-VR-Solution.pdf,63,2022-01-25 05:26:59
AR/VR Immersive Training Systems | AVEVA,"AR/VR Immersive Training Systems is a 3D engineering tool that uses Virtual Reality (VR) to connect control room operators, maintenance, and field personnel ...",https://www.aveva.com/en/products/xr-for-training/,64,2022-01-25 05:26:59
"AR, VR: A different World! | EMK Center, Dhaka, DA","Dec 15, 2021 — AR, VR: A different World! happening at EMK Center, Midas Center Building (9th Floor) House-5, Road-16, Dhanmondi, Dhaka–1209, Bangladesh., ...",https://happeningnext.com/event/ar-vr-a-different-world-eid3a08emo5mg,65,2022-01-25 05:26:59
AR/VR/MR Focus - Optics.org,"AR/VR/MR magazine is the new publication from the team that brings you optics.org, VISION Focus magazine and the Photonics West show daily.",https://optics.org/arvrmr,66,2022-01-25 05:26:59
Virtual - Augmented Reality (AR) - STMicroelectronics,"Sep 9, 2021 — From the entertainment and gaming industry to industrial and medical fields, Augmented Reality (AR) and Virtual Reality (VR) are expanding ...",https://www.st.com/en/applications/virtual-augmented-reality.html,67,2022-01-25 05:26:59
