title,snippet,link,position,date
"Nft Group, LLC Company Profile | New Orleans, LA","Find company research, competitor information, contact details & financial data for Nft Group, LLC of New Orleans, LA. Get the latest business insights from ...",https://www.dnb.com/business-directory/company-profiles.nft_group_llc.78415ddb882f67adcb9e4a799fb991a6.html,53,2022-01-25 05:27:03
BD White - NFT,"B.D. White entered the art scene by painting hundreds of streetlight bases throughout New York City. Despite his spinal injury, he earned a reputation as a ...",https://nftgates.com/people/bd-white,54,2022-01-25 05:27:03
Yuvraj Singh's bat becomes first minted NFT ... - Tribune India,"Dec 25, 2021 — ... century in the 2003 ODI match against Bangladesh in Dhaka. ... “I am excited to share my first NFT space journey exclusively on Colexion ...",https://www.tribuneindia.com/news/sports/yuvraj-singhs-bat-becomes-first-minted-nft-ever-to-be-sent-in-orbit-354383,55,2022-01-25 05:27:03
adidas Originals and Prada Announce a First-of-its-Kind Open ...,4 days ago — The two brands unveil the adidas for Prada re-source project in collaboration with digital artist Zach Lieberman. Proceeds from the NFT ...,https://news.adidas.com/originals/adidas-originals-and-prada-announce-a-first-of-its-kind-open-metaverse---user-generated-nft-project/s/30a29dad-6ded-4302-ae40-f9f2338e7298,56,2022-01-25 05:27:03
LIMITED-BD... NFT for sale at Mintable.app,for sale on the best NFT marketplace to sell blockchain items. ... BrowseDiscoverMint an itemNFT UniversityVote/DAOLogin. Create Account. Ethereum.,https://mintable.app/collectibles/item/LIMITED-BD-CRYPTOCOIN-COIN-1-of-1/profile,57,2022-01-25 05:27:03
NFT resources | Collective Campus,"NFT articles, ebooks, tools, email courses and many more at Collective Campus. ... NFT. Filter by: ALL. Resources. ARTICLES ... FL - Steve Glaveski - BD.",https://www.collectivecampus.io/category/nft,58,2022-01-25 05:27:03
Wikipedia creator's computer and NFT of first edit up for auction,"Dec 4, 2021 — The second lot is for an NFT -- Non-Fungible Tokens are unique digital ... Xiaomi launches first 'Make in Bangladesh' Redmi 9A smartphone ...",https://www.theindependentbd.com/post/270915,59,2022-01-25 05:27:03
BD Multimedia acquires NFT art specialist Metacollector,"7 days ago — For any first subscription to the Bourse Direct Horizon contract between 1is January and January 31, 2022 inclusive with an initial payment ...",https://new.in-24.com/entertainment/News/286580.html,60,2022-01-25 05:27:03
NFT Qatar Beats Bangladesh Community Team In Its Opener ...,"Jan 17, 2020 — Nepal football team Qatar has started Asian communities championship with a bang as they defeated Bangladesh community football team 5-0 on ...",https://www.goalnepal.com/news/detail/8475,61,2022-01-25 05:27:03
NFTs in China and their uncertain future: An in-depth report,"Jan 13, 2022 — Last year saw the non-fungible token, or NFT, break into the mainstream, as hype over the volatile market for digital keys to pixilated ...",https://asia.nikkei.com/Spotlight/Caixin/NFTs-in-China-and-their-uncertain-future-An-in-depth-report,62,2022-01-25 05:27:03
NFT #NFTArtist #NFTShow Episode 3 BD Duffin Preview,,https://www.youtube.com/watch?v=7QwF2D2ZkdI,63,2022-01-25 05:27:03
WWE Shop | The Official Source for WWE Superstar & Legend ...,"The Official source for all your WWE Superstar Merchandise The Official WWE Shop. WWEShop, WWEShop.com, Official WWE Shop, WWE Store, WWE Official Store, ...",https://shop.wwe.com/,64,2022-01-25 05:27:03
Blockchain Monster Hunt,Hunt Monsters. Hunt NFT Monsters from the Multiverse or purchase them from the Marketplace. ... Idon Liu. Boost Innovation Labs North America BD ...,https://bcmhunt.com/,65,2022-01-25 05:27:03
Becoming an NFT Creator & Collector | Udemy,"Nov 28, 2021 — Why is an NFT valuable? Keep your account safe. Buy, sell, create NFTs on Ethereum & Tezos. Choosing NFT collections.",https://www.udemy.com/course/becoming-nft-creator-collector/,66,2022-01-25 05:27:03
barcelona hotel ginebra cnft series - Cardano Hubs,"The proceedings will go towards creating dedicated Cardano spaces in the hotel and also towards our charity project in Bangladesh, Thought for Food.",https://cardanohubs.com/cardano-hotel-nft/,67,2022-01-25 05:27:03
Nft promotion agency - Zenion Technology India,"Due to the popularity of the NFT market, more and more diversified forms of NFT ... DeFi, STO, IEO/ICO, NFT, crypto, blockchain marketing, promotion and PR ...",http://zeniontechnology.com/pwqnva/nft-promotion-agency.html,68,2022-01-25 05:27:03
How China Views NFTs and What Are its Market Prospects?,"3 days ago — While China is cautious about the financialization of NFTs and crypto is a ... investors in The Philippines, Malaysia, Thailand, Bangladesh.",https://www.china-briefing.com/news/how-does-china-view-nfts-and-what-are-its-market-prospects/,69,2022-01-25 05:27:03
Dinesh Karthik's NFT Art - noborderz,"Oct 11, 2021 — Dinesh Karthik claims that NFT's are made ready based on his epic victory over Bangladesh in 2018During the Nidahas Trophy finals.",https://www.noborderz.com/dinesh-karthiks-nft-art/?lang=zh_tw,70,2022-01-25 05:27:03
Melania Trump launches new NFT venture - Digi Bangla,"Dec 16, 2021 — NFT is a type of digital asset that is stored in a blockchain. Keeps track of blockchain transactions and deposit costs through a computer ...",https://digibanglatech.news/english/65834/,71,2022-01-25 05:27:03
NFT in a nutshell: a weekly review - RemoNews,"Sep 5, 2021 — Let's take a look at everything that has happened in the wild world of NFTs over the past week. News on non-fungible tokens this week. OpenSea ...",https://remonews.com/bangladesh/nft-in-a-nutshell-a-weekly-review/,72,2022-01-25 05:27:03
Club CPG Launches NFT-Based 'Crypto Packaged Goods ...,"Oct 1, 2021 — The emergence of non-fungible tokens (NFTs) as a tradable digital ... par with the country of Bangladesh and has a carbon footprint roughly ...",https://www.bevnet.com/news/2021/club-cpg-launches-nft-based-crypto-packaged-goods-platform/,73,2022-01-25 05:27:03
Digital technology dominates when NFT tops the list of power ...,"Dec 1, 2021 — NFTs have been around since 2014 but really made headlines this year when Chris Torres created a pet-based rainbow animation based on his pet ...",https://bangladesh.kivazen.com/digital-technology-dominates-when-nft-tops-the-list-of-power-in-the-art-world/,74,2022-01-25 05:27:03
NFT (NFT) In Bangladesh taka (BDT) - Calculator online ...,"Aug 12, 2021 — NFT In Bangladesh taka sarrifka maanta. Qalabka lacagta lacagta lagu beddelanayo - qiimaha maanta ee sicirka lacagta ee adduunka oo dhan.",https://so.calcprofi.com/convert-NFT-BDT.amp.html,75,2022-01-25 05:27:03
Yuvraj Singh Announces His Own NFT Collection On His 40th ...,"Dec 12, 2021 — Former Indian all-rounder Yuvraj Singh announced that he would to start his non-fungible token (NFT) for his fans.",https://cricketaddictor.com/cricket-news/yuvraj-singh-announces-his-own-nft-collection-on-his-40th-birthday/,76,2022-01-25 05:27:03
Non-fungible Tokens (NFT) Jobs - Freelancer,"109 jobs — we are looking to implement a stakepool for cardano NFTs, would you be able to help us with that? Blockchain Non-fungible Tokens (NFT). $575 (Avg Bid).",https://www.freelancer.com.bd/jobs/non-fungible-tokens/,77,2022-01-25 05:27:03
NFT art market is booming amid an uptick in fraud,6 days ago — The NFT boom has divided visual artists. Some see selling NFTs as a way to exert more control over their art and find new audiences. Others say ...,https://www.businesslive.co.za/bd/companies/2022-01-18-nft-art-market-is-booming-amid-an-uptick-in-fraud/,78,2022-01-25 05:27:03
how to polygon network nft sell opensea. Bangla video,,https://coinmarketbag.com/how-to-polygon-network-nft-sell-opensea-bangla-video/,79,2022-01-25 05:27:03
Afghanistan and Bangladesh qualify for quarter-finals ...,"2 days ago — All the pressure on Sri Lanka and India, who face Afghanistan and Bangladesh respectively. BE A PART OF CRICKET'S NFT REVOLUTION. Get the latest ...",https://www.icc-cricket.com/news/2459870,80,2022-01-25 05:27:03
Specialized in Tower Cranes LLC - NFT,"Why choose NFT? One stop supplier for all your lifting needs. A stock of on average 150 new tower cranes, available and ready ...",https://www.nftcrane.com/top-crane-company/,81,2022-01-25 05:27:03
Best NFT Marketplace Development - Shamlatech,Don't worry we've covered everything about NFTs and the best NFT marketplace platforms in this article that you should never miss.,https://shamlatech.com/the-a-z-guide-of-best-nft-marketplaces-to-invest-2021/,82,2022-01-25 05:27:03
Katy Perry to launch first-ever NFT collection - MSN,"Jun 30, 2021 — Katy Perry has announced the launch of Katy Perry NFTs which will celebrate her 'Play' residency ... United News of Bangladesh (UNB) Logo ...",http://www.msn.com/en-xl/asia/animals/katy-perry-to-launch-first-ever-nft-collection/vp-AALD1hB?ocid=a2hs,83,2022-01-25 05:27:03
How To Sell CoinHub Wallet NFT | Bangla Tutorial - For servers,How To Sell NFT On Opensea | How To Sell CoinHub Wallet NFT | Bangla Tutorial | @Tricks On Online #opensea #nft #coinhub_wallet Hallo Friends Welcome Back ...,https://server.vpnwp.com/hyper-v/how-to-sell-nft-on-opensea-how-to-sell-coinhub-wallet-nft-bangla-tutorial/,84,2022-01-25 05:27:03
Yuvraj Singh's bat becomes first minted NFT ... - Deccan Herald,"Dec 25, 2021 — ... match against Bangladesh in Dhaka. The exercise was done last week in collaboration with Colexion, Asia's NFT market, and the former.",https://www.deccanherald.com/sports/yuvraj-singhs-bat-becomes-first-minted-nft-ever-to-be-sent-in-orbit-1064628.html,85,2022-01-25 05:27:03
India's 1st sports NFT features Dinesh Karthik's 2018 Nidahas ...,"Oct 9, 2021 — Cricketer Dinesh Karthik's last-ball six in the 2018 India-Bangladesh match, the move that won India the Nidahas Trophy that year, ...",https://www.thenewsminute.com/article/indias-1st-sports-nft-features-dinesh-karthik-s-2018-nidahas-trophy-last-ball-six-156307,86,2022-01-25 05:27:03
"Evergreen Products Sets its Sights on E-Commerce, NFT's...","Dec 14, 2021 — ... Evergreen Products Sets its Sights on E-Commerce, NFT's and the Future of Fashion ... Bangladesh Production Center Management Team ...",https://www.epfhk.com/bloomberg-evergreen-products-sets-its-sights-on-e-commerce-nfts-and-the-future-of-fashion/,87,2022-01-25 05:27:03
"CoinDCX - Crypto Exchange | Buy, Sell and Trade Bitcoins ...",CoinDCX is India's largest and safest cryptocurrency exchange where you can buy and sell Bitcoin and other cryptocurrencies with ease.,https://coindcx.com/,88,2022-01-25 05:27:03
Dinesh Karthik on NFTs and Mental Health - Re:Set,"Oct 20, 2021 — Karthik's last ball six in the match between India and Bangladesh has now been turned into India's first sports NFT.",https://resetyoureveryday.com/dinesh-karthik-on-indias-first-sports-nft-mental-health-and-that-iconic-last-ball-six/,89,2022-01-25 05:27:03
Do NFTs Have An Environmentally Sustainable Future? - Jing ...,"Oct 12, 2021 — Eco-friendly NFT platforms such as Voice are springing up in response to the intense ... equivalent to Bangladesh's energy consumption.",https://jingculturecommerce.com/eco-friendly-green-nfts/,90,2022-01-25 05:27:03
India's first-ever sports NFT to feature Dinesh Karthik's last-ball ...,"Oct 14, 2021 — Dinesh Karthik NFT India Cricket Nidhas Trophy ... Karthik's iconic last-ball six against Bangladesh in the final of the 2018 Nidhas Trophy.",https://thebridge.in/cricket/india-first-sport-nft-dinesh-karthik-nidhas-trophy-six-25964,91,2022-01-25 05:27:03
Chairman's Reserve Extra Añejo | Exclusive Tequila NFT,"The NFT Proves Your Ownership. To taste this ultra-rare offering, you must purchase one of 150 limited-edition NFTs that each correspond to a physical bottle of ...",https://www.patrontequila.com/products/chairmans-reserve-extra-anejo.html,92,2022-01-25 05:27:03
Testing Your Equilibrium by BD White - NFT Calendar,"May 26, 2021 — On May 26th, a New York City-based street artist and painter B. D. White drops 'Testing Your Equilibrium' NFT Collection presented by IV ...",https://nftcalendar.io/event/testing-your-equilibrium-by-b-d-white/,93,2022-01-25 05:27:03
The climate controversy swirling around NFTs - The Verge,"Mar 15, 2021 — Most NFTs are bought and sold with Ethereum, a cryptocurrency that guzzles up energy and pumps out a lot of greenhouse gas emissions.",https://www.theverge.com/2021/3/15/22328203/nft-cryptoart-ethereum-blockchain-climate-change,94,2022-01-25 05:27:03
Untitled,"An entrance ticket to the fascinating world of NFT is waiting for you! Crypto Donut Donation is 10,000 unique creations, programmatically generated by code, ...",https://garshaclub.com/n3fkw07/donuts-ethereum.html,95,2022-01-25 05:27:03
Dinesh Karthik's Last-Ball Six During IND vs BAN Nidahas ...,"Oct 9, 2021 — ... thoughts during the last-ball six in the 2018 India-Bangladesh match. ... First Sporting NFT, Cricketer Announces Development (Check Tweet).",https://www.latestly.com/socially/sports/cricket/dinesh-karthiks-last-ball-six-during-ind-vs-ban-nidahas-trophy-2018-final-set-to-be-indias-first-sporting-nft-cricketer-announces-development-check-tweet-2935242.html,96,2022-01-25 05:27:03
India's First Ever Sports NFT Features Dinesh Kathik's Iconic ...,"Oct 12, 2021 — PRNewswire/ -- Cricketer Dinesh Karthik's last-ball six in the 2018 India-Bangladesh match, the move that won India the Nidahas Trophy that ...",https://www.prnewswire.com/in/news-releases/india-s-first-ever-sports-nft-features-dinesh-kathik-s-iconic-2018-nidahas-trophy-last-ball-six-802814752.html,97,2022-01-25 05:27:03
Metaverse Explanation in Bangla - YouTube,,https://www.youtube.com/watch?v=9uNVYqNTxmQ,98,2022-01-25 05:27:14
3D Works of Bangladeshi Children in Metaverse - YouTube,,https://www.youtube.com/watch?v=FbswmDB1NsY,99,2022-01-25 05:27:14
"Metaverse Land: ভার্চুয়াল জগতে জমি নেওয়ার হুড়োহুড়ি, কোটি ...","Aajtak Bangla. 24 Dec 2021,; Updated 11:20 AM IST. Metaverse Land: ভার্চুয়াল জগতে জমি নেওয়ার হুড়োহুড়ি, ...",https://bangla.aajtak.in/technology-gadget/photo/metaverse-land-sold-more-1-crore-rupees-know-how-buy-sud-326161-2021-12-24,100,2022-01-25 05:27:14
Is the Future of Esports in the Metaverse?,"Nov 10, 2021 — We may be a few years off before you can don a VR headset and hop into the metaverse, but the idea holds endless potential for esports as ...",https://blog.the-esports-bar.com/innovation/is-the-future-of-esports-in-the-metaverse/,101,2022-01-25 05:27:14
"To Build The Metaverse, Meta First Wants To Build Stores","Nov 6, 2021 — Bangladesh Todays is a popular daily online news media in Bangladesh, published from Dhaka in the Bengali language. Based on circulation, ...",https://bangladeshtodays.com/to-build-the-metaverse-meta-first-wants-to-build-stores/,102,2022-01-25 05:27:14
Microsoft to gobble up Activision in $69 billion metaverse bet,"6 days ago — Microsoft Corp is buying ""Call of Duty"" maker Activision Blizzard for $68.7 billion in the biggest gaming industry deal in history as global ...",https://en.prothomalo.com/corporate/global/microsoft-to-gobble-up-activision-in-69-billion-metaverse-bet,103,2022-01-25 05:27:14
Metaverse & the future of TV Industry - MIPTrends,"Nov 10, 2021 — Right now, most of us interact with the “metaverse“ through consumer-facing, interactive and immersive virtual platforms, such as video ...",https://www.miptrends.com/tv-business/metaverse-the-future-of-tv-industry-2/,104,2022-01-25 05:27:14
"AMTD International acquires L'Officiel, opens virtual space in ...","4 days ago — Titled “Fashion Skin,” the project will include a collection of metaverse-ready virtual clothing. The pieces will be developed by applying ...",https://www.theedgesingapore.com/news/ma/amtd-international-acquires-lofficiel-opens-virtual-space-metaverse,105,2022-01-25 05:27:14
Nadella Shares Microsoft's Vision for a 'Metaverse' at Ignite,"Nov 4, 2021 — An Ignite keynote talk by Satya Nadella, Microsoft's CEO, focused on the shift to ""hybrid"" remote work, the use of artificial intelligence ...",https://redmondmag.com/articles/2021/11/04/nadella-embraces-metaverse-in-ignite.aspx,106,2022-01-25 05:27:14
T-Series and HEFTY Entertainment a division of Hungama ...,19 hours ago — T-Series and HEFTY Entertainment a division of Hungama Digital Media announce their foray into the Metaverse with soon to be launched NFTs.,https://www.bollywoodhungama.com/news/bollywood/t-series-hefty-entertainment-division-hungama-digital-media-announce-foray-metaverse-soon-launched-nfts/,107,2022-01-25 05:27:14
Google Alerts - Monitor the Web for interesting new content,Bangladesh. Barbados. Belarus. Belgium. Belize. Benin. Bermuda. Bhutan. Bolivia. Bosnia & Herzegovina. Botswana. Bouvet Island.,https://www.google.com/alerts,108,2022-01-25 05:27:14
Luxury Brands Are Already Making Millions in the Metaverse,"Dec 8, 2021 — “The metaverse”—as the expanding terrain of virtual environments is ... really came from the Rana Plaza incident in Bangladesh, where the ...",https://www.bloomberg.com/news/articles/2021-12-09/luxury-fashion-brands-are-already-making-millions-in-the-metaverse,109,2022-01-25 05:27:14
"Lakshmi Manchu ventures into metaverse, buys 'Azuki' NFT","16 hours ago — Hyderabad, Jan 24 (IANS) Telugu actress Lakshmi Manchu has taken her opening step into metaverse, with the purchase of her first ...",https://www.buzinessbytes.com/others/lakshmi-manchu-ventures-into-metaverse-buys-azuki-nft/,110,2022-01-25 05:27:14
Bangladeshi minor allegedly killed teenage friend over PUBG ...,"Oct 18, 2021 — A 16-year-old committed murder of a 14-year for a dispute over PUBG Mobile in Bangladesh, the case aroused lot of concerns for the ...",https://gamingonphone.com/news/bangladeshi-minor-allegedly-killed-teenage-friend-over-pubg-mobile/,111,2022-01-25 05:27:14
Raima Islam Shimu's husband confesses to murdering the ...,"6 days ago — Bangladeshi actress Raima Islam Shimu went missing a few days back and later her body was found in a sack. Now, her husband has confessed to ...",https://www.timesnownews.com/entertainment-news/article/raima-islam-shimu-s-husband-confesses-to-murdering-the-bangladeshi-actress-dead-body-found-in-a-sack/850827,112,2022-01-25 05:27:14
Meta versity bangladesh: WN,"Khosru + Moyna | Bangla Natok | Tisha, Marjuk Rasel, Musafir Syed, Kochi Khandaker ... The Metaverse Tokens MANA And SAND Price Analysis For December 12th.",https://metaversitybangladesh.com/,113,2022-01-25 05:27:14
Bangladesh To Use $ 208 Million IT Project Fund For ...,"Aug 5, 2019 — Bangladesh are planning on sending a hundred graduates for this training program to boost their expertise in the fields of ml, AI, and DLT.",https://www.blockchain-council.org/blockchain/bangladesh-to-use-208-million-it-project-fund-for-blockchain-training/,114,2022-01-25 05:27:14
How Brands Can Shape the Metaverse to their Advantage,"Nov 8, 2021 — In order to succeed authentically in the metaverse, many brands will have to leave their usual marketing strategies and patterns behind. Brands ...",https://www.ogilvy.com/ideas/how-brands-can-shape-metaverse-their-advantage,115,2022-01-25 05:27:14
What is the metaverse? It could succeed the internet.,"Aug 17, 2021 — The metaverse is a network of always-on virtual environments in which many people can interact with one another and digital objects while ...",https://www.yoursun.com/charlotte/features/what-is-the-metaverse-it-could-succeed-the-internet/article_50153170-fba1-11eb-8388-77e5c8e42e0c.html,116,2022-01-25 05:27:14
The Metaverse explained with examples - bd.business,,https://bd.business/videos/the-metaverse-explained-with-examples,117,2022-01-25 05:27:14
Metaverse-BD - Home | Facebook,"Nov 14, 2021 — মেটাভার্সে কি ডেট করা যাবে? www.metaverse-bd.com. SAMAKAL.COM. 'মেটাভার্স' ...",http://metaverse-bd.com/,118,2022-01-25 05:27:14
Metaverse এ ভার্চুয়াল জমি বিক্রির রেকর্ড - Zoom Bangla News,এরই মধ্যে ২৪ লাখ ৩০ হাজার মার্কিন ডলারের রেকর্ড মূল্যে ভার্চুয়াল জমি বিক্রি করে ...,https://inews.zoombangla.com/metaverse-%E0%A6%8F-%E0%A6%AD%E0%A6%BE%E0%A6%B0%E0%A7%8D%E0%A6%9A%E0%A7%81%E0%A7%9F%E0%A6%BE%E0%A6%B2-%E0%A6%9C%E0%A6%AE%E0%A6%BF/,119,2022-01-25 05:27:14
Facebook is planning to rebrand the company with a new name,"Oct 19, 2021 — Facebook plans to change its company name to focus on the metaverse. On October 28th, CEO Mark Zuckerberg revealed the company will change ...",https://www.theverge.com/2021/10/19/22735612/facebook-change-company-name-metaverse,120,2022-01-25 05:27:14
How MapmyIndia is charting the metaverse territory - The ...,"Nov 28, 2021 — The company has been offerings its APIs and SaaS products across 200 countries including Sri Lanka, Bangladesh, Nepal, Bhutan, Myanmar, ...",https://www.thehindubusinessline.com/info-tech/how-mapmyindia-is-charting-the-metaverse-territory/article37738199.ece,121,2022-01-25 05:27:14
How People in the Philippines Are Making Money in the ...,"May 19, 2021 — The Settlers of the Metaverse. During the pandemic last spring, unemployment in the Philippines hit 40%. For reference, U.S. unemployment ...",https://digitalnative.substack.com/p/how-people-in-the-philippines-are,122,2022-01-25 05:27:14
Rumfoords | Metaverse Agency,"Rumfoords is a strategic and creative consultancy guiding brands through crypto, NFTs, blockchain and the Metaverse.",https://rumfoords.com/,123,2022-01-25 05:27:14
"Horizon Worlds, Meta's biggest metaverse app, opens to the ...","Dec 9, 2021 — It enters public beta today. Meta. It's been two years since Facebook -- now Meta -- first showed off its VR metaverse app, ...",https://www.cnet.com/tech/computing/metas-biggest-metaverse-app-horizon-worlds-opens-to-the-public/,124,2022-01-25 05:27:14
What Is The Metaverse? An Easy Explanation For Anyone,"Sep 3, 2021 — However, it's clearly a concept that we've been building towards since the emergence of the internet, social media, virtual reality, and early ...",https://bernardmarr.com/what-is-the-metaverse-an-easy-explanation-for-anyone/,125,2022-01-25 05:27:14
Animoca Brands,"Animoca Brands and SUPERPLASTIC partner to provide metaverse experiences for Headtripz NFTs in The Sandbox and REVV Racing. January 20, 2022.",https://www.animocabrands.com/,126,2022-01-25 05:27:14
The Metaverse Emerges - Bankless,"Sep 1, 2021 — How the metaverse acts as a bottom-up emergent structure for a new digital world. David Hoffman. Sep 1, 2021.",https://newsletter.banklesshq.com/p/the-metaverse-emerges,127,2022-01-25 05:27:14
adidas Originals and Prada Announce a First-of-its-Kind Open ...,4 days ago — The two brands unveil the adidas for Prada re-source project in collaboration with digital artist Zach Lieberman. Proceeds from the NFT ...,https://news.adidas.com/originals/adidas-originals-and-prada-announce-a-first-of-its-kind-open-metaverse---user-generated-nft-project/s/30a29dad-6ded-4302-ae40-f9f2338e7298,98,2022-01-25 05:28:01
"Evergreen Products Sets its Sights on E-Commerce, NFT's...","Dec 14, 2021 — ... Evergreen Products Sets its Sights on E-Commerce, NFT's and the Future of Fashion ... Bangladesh Production Center Management Team ...",https://www.epfhk.com/bloomberg-evergreen-products-sets-its-sights-on-e-commerce-nfts-and-the-future-of-fashion/,99,2022-01-25 05:28:01
Blockchain Monster Hunt,Hunt Monsters. Hunt NFT Monsters from the Multiverse or purchase them from the Marketplace. ... Idon Liu. Boost Innovation Labs North America BD ...,https://bcmhunt.com/,100,2022-01-25 05:28:01
Reigning champions Bangladesh bounce back against Canada,4 days ago — The 2020 ICC Under-19 Men's Cricket World Cup winners Bangladesh bounced back from defeat to ... BE A PART OF CRICKET'S NFT REVOLUTION.,https://www.icc-cricket.com/news/2456354,101,2022-01-25 05:28:01
Dinesh Karthik on NFTs and Mental Health - Re:Set,"Oct 20, 2021 — Karthik's last ball six in the match between India and Bangladesh has now been turned into India's first sports NFT.",https://resetyoureveryday.com/dinesh-karthik-on-indias-first-sports-nft-mental-health-and-that-iconic-last-ball-six/,102,2022-01-25 05:28:01
"Donuts ethereum. Currently costs 1,000,000 DONUTS. How it ...","An entrance ticket to the fascinating world of NFT is waiting for you! Crypto Donut Donation is 10,000 unique creations, programmatically generated by code, ...",https://garshaclub.com/n3fkw07/donuts-ethereum.html,103,2022-01-25 05:28:01
How China Views NFTs and What Are its Market Prospects?,"3 days ago — While China is cautious about the financialization of NFTs and crypto is a ... investors in The Philippines, Malaysia, Thailand, Bangladesh.",https://www.china-briefing.com/news/how-does-china-view-nfts-and-what-are-its-market-prospects/,104,2022-01-25 05:28:01
NFT market may witness a correction in the short term - News,"2 days ago — The National Payments Corporation of India has advised fintechs to keep aside money and management bandwidth for regulatory compliance, ...",https://www.khaleejtimes.com/business/nft-market-may-witness-a-correction-in-the-short-term,105,2022-01-25 05:28:01
