title,snippet,link,position,date
Metaverse: What is it all about? - The Business Standard,"Dec 30, 2021 — The metaverse, according to the likes of Mark Zuckerberg or Satya Nadella, is the internet's future.",https://www.tbsnews.net/features/panorama/metaverse-what-it-all-about-350731,0,2022-01-25 05:26:49
Metaverse gets touch of reality at CES - New Age,"Jan 7, 2022 — New Age, a Dhaka-based leading English language daily newspaper, is a major source of news of Bangladesh and international affairs.",https://www.newagebd.net/article/159367/metaverse-gets-touch-of-reality-at-ces,1,2022-01-25 05:26:49
Metaverse Explanation in Bangla - YouTube,,https://www.youtube.com/watch?v=9uNVYqNTxmQ,2,2022-01-25 05:26:49
3D Works of Bangladeshi Children in Metaverse - YouTube,,https://www.youtube.com/watch?v=FbswmDB1NsY,3,2022-01-25 05:26:49
"The (Virtual) Reality of The Metaverse, Successor of The Internet","Oct 27, 2021 — The metaverse: the next evolution in online experience. A concept that provides a virtual parallel to physical reality where a community of ...",https://cgs-bd.com/article/4765/The--Virtual--Reality-of-The-Metaverse%2C-Successor-of-The-Internet,4,2022-01-25 05:26:49
Understanding the Metaverse | The Daily Star,Understanding the Metaverse · Walton launches laptops with 11th Gen Intel processors · Symphony starts exporting Bangladesh-made smartphones to Nepal.,https://www.thedailystar.net/toggle/news/understanding-the-metaverse-2227591,5,2022-01-25 05:26:49
'Metaverse' hype fuels booming digital property market - The ...,"Dec 5, 2021 — The idea of spending millions on non- existent land may sound ludicrous -- but feverish predictions of a virtual reality future are pushing ...",https://m.theindependentbd.com/post/270958,6,2022-01-25 05:26:49
The Metaverse's dark side: here come harassment and assaults,"Dec 31, 2021 — Bad behaviour in the metaverse can be more severe than today's online harassment and bullying. That's because virtual reality plunges people ...",https://bdnews24.com/technology/2021/12/31/the-metaverses-dark-side-here-come-harassment-and-assaults,7,2022-01-25 05:26:49
Introduce to the era of METAVERSE - Daily Bangla,"Dec 27, 2021 — The easiest way to visualize the metaverse is to think of yourself as a character in a video game. You can take on a new face and a new ...",https://dailybanglaa.com/international/introduce-to-the-era-of-metaverse/,8,2022-01-25 05:26:49
When will the Metaverse replace your phone: In the dawn of ...,All Bangla Latest All News Opera mini Feed Bangladesh ... When will the Metaverse replace your phone: In the dawn of the revolution. 4 days ago 28.,http://news.bdtype.com/when-will-the-metaverse-replace-your-phone-in-the-dawn-of-the-revolution-500269.html,9,2022-01-25 05:26:49
"Facebook opens virtual world app to public, inching toward ...","Dec 10, 2021 — Horizon Worlds is far from a fully realized metaverse, a future internet where online experiences like chatting to a friend would eventually ...Dec 16, 2021 — NEW YORK, Dec 16, 2021 (BSS/AFP) - The metaverse vision for the internet is far from reality, but brands from Ferrari...",https://www.bssnews.net/news/32802,10,2022-01-25 05:26:49
"Facebook's metaverse aspirations tied to privacy, antitrust ...","Nov 1, 2021 — As Mark Zuckerberg spun his vision last week for the metaverse and Facebook's transformation into a company built on immersive experiences ...",https://mlexmarketinsight.com/news-hub/editors-picks/area-of-expertise/antitrust/facebooks-metaverse-aspirations-tied-to-privacy-antitrust-regulation,11,2022-01-25 05:26:49
Jade Bangladesh (@jadebangladesh) / Twitter,Metaverse tokens are on the rise and that's why we've announced the start of building the JADE SHOP in decentraland. In a few days you will see the shop ready ...,https://twitter.com/jadebangladesh,12,2022-01-25 05:26:49
"CEOs, it is time to enter the metaverse - EY","6 days ago — From luxury labels to Big Tech, everyone wants a piece of the metaverse. But how will these virtual worlds affect Indian businesses?",https://www.ey.com/en_in/ceo/ceos-it-is-time-to-enter-the-metaverse,13,2022-01-25 05:26:49
TIME - Into the Metaverse,Into the Metaverse. Your guide to the future of the Internet. You can unsubscribe at any time. By signing up you are agreeing to our TIME Terms Of Use and ...,https://cloud.newsletters.time.com/into-the-metaverse?source=meta_onsite,14,2022-01-25 05:26:49
Microsoft to buy Activision in $69b metaverse bet - The ...,"6 days ago — Over Tk40b misspent on misconceived BRT route! Iraq keen to boost trade, investment with Bangladesh. Most Viewed News. 165677. A ...",https://thefinancialexpress.com.bd/trade/microsoft-to-buy-activision-in-69b-metaverse-bet-1642564103,15,2022-01-25 05:26:49
IDARE | Build Your Own Energy Metaverse,We provides digital twin system builder that helps energy companies to enable solutions for asset life cycle management in one digital eco system.,https://idare.io/,16,2022-01-25 05:26:49
Enter a search term or a topic - Google Trends,Explore how Google data can be used to tell stories. featured. Year in Search 2021. Explore the year through the lens of Google Trends data.,https://trends.google.com/trends/?geo=HK,17,2022-01-25 05:26:49
What Is the Metaverse? A New Reality Explained - XR Today,"Jan 4, 2022 — XR Today reports on the latest Metaverse news from around the globe. Including virtual reality, augmented reality and mixed reality.",https://www.xrtoday.com/mixed-reality/what-is-the-metaverse/,18,2022-01-25 05:26:49
"Virtual worlds, real people: human rights in the metaverse","Dec 9, 2021 — Access Now and EFF call on governments and companies to address the risks that XR technologies and the ""metaverse"" pose to human rights.",https://www.accessnow.org/human-rights-metaverse-virtual-augmented-reality/,19,2022-01-25 05:26:49
METAVERSE - Facebook (Digital Avatars Connect) 2021-12-02,,https://www.bangladeshpost.net/video-galleries/27/metaverse-facebook-digital-avatars-connect,20,2022-01-25 05:26:49
What Is the Metaverse (And How Can I Invest In It?) | Nasdaq,"Jan 7, 2022 — But where will the actual investing opportunities in the metaverse lie? Let's dig into the technology itself, then talk about the potential ...",https://www.nasdaq.com/articles/what-is-the-metaverse-and-how-can-i-invest-in-it,21,2022-01-25 05:26:49
EON Reality: Augmented and Virtual Reality Solutions,"The collaboration with AMTRON brings the knowledge metaverse and EON-XR to India. ... Australia, Austria, Azerbaijan, Bahamas, Bahrain, Bangladesh, Barbados ...",https://eonreality.com/,22,2022-01-25 05:26:49
"John Buzzell - Lead, Enterprise BD, Unreal Engine (Americas)",John Buzzell. Unreal Engine Enterprise Lead | Bestselling Author: 'The Augmented Workforce' | Guiding companies to the Metaverse. Epic GamesThe University ...,https://www.linkedin.com/in/jbuzzell,23,2022-01-25 05:26:49
Metaverse - Wikipedia,"A metaverse is a network of 3D virtual worlds focused on social connection. In futurism and science fiction, the term is often described as a hypothetical ...",https://en.wikipedia.org/wiki/Metaverse,24,2022-01-25 05:26:49
From metaverse to NFT: Here is all you need to know about ...,"The metaverse broadly refers to shared, immersive digital environments which people can move between and may access via virtual reality or augmented reality ...",https://www.wionews.com/photos/from-metaverse-to-nft-here-is-all-you-need-to-know-about-tech-buzzwords-of-2021-439134,25,2022-01-25 05:26:49
What we can do & How to Play & Earn with NFT & Metaverse?,,https://hi-in.facebook.com/StudyAbroadMR/videos/1027586171432751,26,2022-01-25 05:26:49
2 ETP to BDT Converter | Metaverse ETP to BDT - Digital Coin ...,2 ETP to BDT - We are providing Metaverse ETP to BDT converter tool with real-time online exchange rate calculator. How much Bangladeshi Taka (BDT) is 2 ...,https://digitalcoinprice.com/converter/metaverse/bdt/2,27,2022-01-25 05:26:49
PwC HK buys plot on metaverse The Sandbox - Tech in Asia,"Dec 24, 2021 — This comes a few weeks after Hong Kong property tycoon Adrian Cheng bought one of the largest virtual plots in the platform.Dec 15, 2021 — We take a look at Sea Group's potential in the metaverse space and Zoomcar's rapid expansion across SEA.",https://www.techinasia.com/pwc-hk-buys-plot-metaverse-sandbox,28,2022-01-25 05:26:49
South Korea's KT and Shinhan Bank step into metaverse with ...,6 days ago — SEOUL -- South Korean telecommunications carrier KT and Shinhan Financial Group have signed a comprehensive digital tie-up and ...,https://asia.nikkei.com/Business/Technology/South-Korea-s-KT-and-Shinhan-Bank-step-into-metaverse-with-tie-up,29,2022-01-25 05:26:49
Breakroom Metaverse - Virtual Collaboration  Networking ...,Brett D. BD. Brett D. Director Traderoot Technologies. The future of virtual meetings! 11/21/2021.,https://www.breakroom.net/,30,2022-01-25 05:26:49
Facebook name change: What is the metaverse and how will it ...,"Oct 29, 2021 — But Zuckerberg and his team are hardly the only tech visionaries with ideas on how the metaverse, which will employ a mix of virtual reality and ...",https://www.khaleejtimes.com/tech/facebook-name-change-what-is-the-metaverse-and-how-will-it-work,31,2022-01-25 05:26:49
Why CLOs Should Care About the Future of the Metaverse,"In this webinar, you'll hear from Derek Belch, CEO at Strivr, and Krista Taylor, Global Immersive Learning Lead at Accenture, who are two of today's top thought ...",https://event.on24.com/wcc/r/2167403/C74448E0850D4418731BFCD9CCC0F288?partnerref=WEB_TM,32,2022-01-25 05:26:49
S Korea aims to be world's 5th biggest metaverse market by ...,1 day ago — South Korea will cultivate 220 companies and 40000 professionals specialised in metaverse technology to achieve its target of turning the ...,https://www.fibre2fashion.com/news/e-commerce-industry/s-korea-aims-to-be-world-s-5th-biggest-metaverse-market-by-2026-278532-newsdetails.htm,33,2022-01-25 05:26:49
Welcome to 'CEEK City' – H&M's store in metaverse! - Apparel ...,"Jan 3, 2022 — Subscribe Now! ... AO BANGLADESH December 2021 ... Your insight into the world of the movers and shakers of the Bangladesh manufacturing industry.",https://apparelresources.com/technology-news/retail-tech/welcome-ceek-city-hms-store-metaverse/,34,2022-01-25 05:26:49
Free Online Bangladeshi taka (BDT) and Metaverse ETP (ETP ...,Online calculator to convert money from Bangladeshi taka (BDT) to Metaverse ETP (ETP) using up to date exchange rates. Source: free currency rates (FCR),https://freecurrencyrates.com/en/convert-BDT-ETP,35,2022-01-25 05:26:49
5 tech trends to watch in 2022 | World Economic Forum,"Jan 14, 2022 — Expect more buzz around the metaverse in 2022 with lines between the physical ... Bangladesh, Qatar, Egypt and Morocco ban cryptocurrency.",https://www.weforum.org/agenda/2022/01/tech-trends-in-2022/,36,2022-01-25 05:26:49
"Hyundai looks beyond cars to link real, virtual worlds in ...","Jan 5, 2022 — With the metaverse set to become a daily space for people in the near future, the top South Korean automaker said it expects the emergence ...",https://www.kedglobal.com/newsView/ked202201050021,37,2022-01-25 05:26:49
Walmart reveals plans to enter blockchain-based Metaverse ...,"8 days ago — Amid the buzz around Metaverse, retail giant Walmart has revealed plans to enter the field of highly immersive virtual reality/augmented ...",https://www.business-standard.com/article/companies/walmart-reveals-plans-to-enter-blockchain-based-metaverse-sell-nfts-122011700262_1.html,38,2022-01-25 05:26:49
"Facebook to hire 10,000 to work on metaverse - Daily ...","Oct 18, 2021 — Science & IT Deskdaily-bangladesh.com ... A metaverse is an online world where people can game, work and communicate in a virtual ...",https://m.daily-bangladesh.com/english/Facebook-to-hire-10000-to-work-on-metaverse/65077,39,2022-01-25 05:26:49
VR Metaverse - Panasonic North America,"From the MeganeX ultra-lightweight VR headset to the HaritoraX motion tracking device and beyond, Shiftall is making the metaverse more immersive than ever.",https://na.panasonic.com/explore/immersive/vr-metaverse,40,2022-01-25 05:26:49
The industrial plant workforce training of the future: metaverse,"Nov 8, 2021 — How could metaverse be incorporated into workforce training, and could this be the next digital revolution in the oil & gas industry?",https://vr.linde.com/2021/11/08/the-industrial-plant-workforce-training-of-the-future-metaverse/,41,2022-01-25 05:26:49
Purchasing the Metaverse — How Does It Work? - Brink News,"This is thought to be the largest metaverse real estate transaction to date. BRINK spoke to the CEO of Republic Realm, Janine Yorio, to find out what it entails ...",https://www.brinknews.com/purchasing-the-metaverse-how-does-it-work/,42,2022-01-25 05:26:49
The Metaverse Is The Medium | MMA - Mobile Marketing ...,"MMA and Culture Group are proud to share The Metaverse is the Medium, our whitepaper detailing the future of consumer engagement in the virtual realm.",https://www.mmaglobal.com/documents/metaverse-medium,43,2022-01-25 05:26:49
Cryptocurrency: What you need to know about Metaverse ...,"Sep 8, 2021 — Several digital currency exchanges are eyeing India to launch trading platform to capture the growing domestic crypto market.",https://www.hindustantimes.com/business/cryptocurrency-what-you-need-to-know-about-metaverse-solana-and-other-terms-101631077681489.html,44,2022-01-25 05:26:49
The Future of the Metaverse + AI and Data Looks Bright,"Jan 7, 2022 — We're on the cusp of major breakthroughs in the metaverse, that collective world of new augmented reality (AR) and virtual reality (VR) ...",https://www.datanami.com/2022/01/07/the-future-of-metaverse-ai-and-data-looks-bright/,45,2022-01-25 05:26:49
Facebook changes its name to Meta as it focuses on metaverse,"Oct 28, 2021 — CEO Mark Zuckerberg says the new name chimes with the social media giant's focus on building a virtual world for users.",https://www.businesslive.co.za/bd/companies/2021-10-28-facebook-changes-its-name-to-meta-as-it-focuses-on-metaverse/,46,2022-01-25 05:26:49
"Bangladesh, India partnership has matured; need to focus on ...","Dec 6, 2021 — Asserting that the Indo-Bangla ties are not confined to treaties and agreements, Bangladeshi Prime Minister Sheikh Hasina on Monday said the ...",https://www.deccanherald.com/national/bangladesh-india-partnership-has-matured-need-to-focus-on-trade-connectivity-sheikh-hasina-1058255.html,47,2022-01-25 05:26:49
Is Thailand Ready for the Metaverse? - Dhaka Stories,"Jan 4, 2022 — Dhaka: Five years ago, there was an attack on an Artisan Bakery in posh locality in Dhaka by Jamat-ul Mujahideen Bangladesh (JMB). 20 people ...",https://dhakastories.com/2022/01/04/is-thailand-ready-for-the-metaverse/,48,2022-01-25 05:26:49
Mystery surrounds Bangladesh cricketer's disappearance - BBC,"Mystery continues to surround the disappearance of Bangladeshi cricket's star ... of ourselves to augmented reality, we break down what the metaverse is.",https://www.bbc.co.uk/news/av/world-south-asia-34333428,49,2022-01-25 05:26:49
Metaverse: A new terrain for brands to play digital marketing ...,"Nov 2, 2021 — Metaverse is expected to reboot digital advertising, ... March 2018 (in a match against Bangladesh) into an animated film 'Six for the win' ...",https://www.exchange4media.com/digital-news/metaverse-a-new-terrain-for-brands-to-play-digital-marketing-game-116666.html,50,2022-01-25 05:26:49
Musk Metaverse to BDT Chart (METAMUSK/BDT) | CoinGecko,Get live charts for METAMUSK to BDT. Convert Musk Metaverse (METAMUSK) to Bangladeshi Taka (BDT).,https://www.coingecko.com/en/coins/musk-metaverse/bdt,51,2022-01-25 05:26:49
Jim Cramer says these 4 companies are the best ways to ...,"Nov 11, 2021 — “In the future, there will be many companies that will try to claim that they have gotten a piece of the metaverse,” said the “Mad Money” ...",https://remonews.com/bangladesh/jim-cramer-says-these-4-companies-are-the-best-ways-to-invest-in-the-metaverse/,52,2022-01-25 05:26:49
The metaverse: challenges and opportunities | Lombard Odier,"Dec 21, 2021 — Life, the metaverse and everything. We examine the investment opportunities beyond the hype and explore the virtual, immersive future of our ...",https://www.lombardodier.com/contents/corporate-news/investment-insights/2021/december/special-report--metaverse-overhy.html,53,2022-01-25 05:26:49
Jack Teoh backs 22-year-old to launch $50m metaverse fund,"Jan 5, 2022 — Mr Haque was born to Bangladeshi parents who fled Bangladesh for South Africa in their 20s, searching for a better life and to study medicine. “ ...",https://www.afr.com/technology/jack-teoh-backs-22-year-old-to-launch-50m-metaverse-fund-20220104-p59lrl,54,2022-01-25 05:26:49
"Into the mysterious world of Metaverse, a fully realised digital ...","Jul 13, 2021 — The metaverse refers to a variety of virtual experiences, environments and assets that gained momentum during the online-everything shift of ...",https://economictimes.indiatimes.com/magazines/panache/into-the-mysterious-world-of-metaverse-a-fully-realised-digital-space-that-exists-beyond-the-analog/articleshow/84373750.cms,55,2022-01-25 05:26:49
"Metaverse Corporation - Monmouth Junction, NJ - Dun ...","Find company research, competitor information, contact details & financial data for Metaverse Corporation of Monmouth Junction, NJ.",https://www.dnb.com/business-directory/company-profiles.metaverse_corporation.81cfe4fa03b5dc5d48d407d8c128f4a2.html,56,2022-01-25 05:26:49
Zuckerberg plans to turn trillion-dollar Facebook into a ...,"Aug 14, 2021 — “Oculus has the chance to create the most social platform ever, and change the way we work, play and communicate.” Becoming “a metaverse company ...",https://www.businessinsiderbd.com/tech/news/9009/zuckerberg-plans-to-turn-trillion-dollar-facebook-into-a-metaverse-company,57,2022-01-25 05:26:49
Chinese institute to form virtual space collaborative editing ...,"Dec 16, 2021 — According to the announcement, the institution will carry out research on virtual twin and metaverse collaborative modeling and simulation, in ...",https://www.globaltimes.cn/page/202112/1241609.shtml,58,2022-01-25 05:26:49
The Boring Art of Zuckerberg's Metaverse - ArtReview,"Nov 12, 2021 — From floating '3D street art' to a talking Henri Rousseau painting, Meta's vision of the future is drained of all imagination.",https://artreview.com/the-boring-art-of-zuckerberg-metaverse/,59,2022-01-25 05:26:49
adidas Originals and Prada Announce a First-of-its-Kind Open ...,4 days ago — adidas and Prada will invite their collective audiences to contribute unique anonymized photographs to the open-Metaverse NFT project.,https://news.adidas.com/originals/adidas-originals-and-prada-announce-a-first-of-its-kind-open-metaverse---user-generated-nft-project/s/30a29dad-6ded-4302-ae40-f9f2338e7298,60,2022-01-25 05:26:49
6 Ways to Advertise Your Brand in the Metaverse - Collective ...,"So you've got a big marketing budget, and are wondering whether it's worth dabbling in the metaverse. Given that Travis Scott's concert on Fortnite drew ...",https://www.collectivecampus.io/blog/6-ways-to-advertise-your-brand-in-the-metaverse,61,2022-01-25 05:26:49
What Is Bloktopia (BLOK)? One of the Biggest Metaverse ...,"The Latest Hype in the Cryptocurrency Space Is the Metaverse ... on the Elrond blockchain,” announced Daniel Serb, BD at Elrond, in a recent blog post.",https://coinmarketcap.com/alexandria/article/what-is-bloktopia-real-estate-metaverse,62,2022-01-25 05:26:49
Getting aboard the Metaverse bus and reaping from it,"Nov 25, 2021 — At the close of the first decade of this century, virtual goods took the world by storm. Social game companies like Zynga rode on the ...",https://www.businessdailyafrica.com/bd/corporate/technology/getting-aboard-metaverse-bus-reaping-from-it-3629932,63,2022-01-25 05:26:49
Bangladeshi minor allegedly killed teenage friend over PUBG ...,"Oct 18, 2021 — Krafton PUBG metaverse, Bangladesh High Court ban PUBG Mobile Free Fire, Nova Esports PUBG Image by KRAFTON. In yet another very unfortunate ...",https://gamingonphone.com/news/bangladeshi-minor-allegedly-killed-teenage-friend-over-pubg-mobile/,64,2022-01-25 05:26:49
Get Free Facebook metaverse logo for your brand - Pinterest,"Nov 21, 2021 - Get Free Facebook metaverse logo for your brand - Free Mockup | Download Free Mockup PSD | Free Vector. ... Freelancing Support BD.",https://www.pinterest.com/pin/762234305693609766/,65,2022-01-25 05:26:49
Apple Glasses: Everything we've heard so far | Tom's Guide,"3 days ago — We would not expect the Apple Glass release date to be anytime soon. That's because an Apple AR/VR headset is expected first, which is tipped to ...",https://www.tomsguide.com/news/apple-glasses,66,2022-01-25 05:26:49
"'Made in Bangladesh' may mean Target, H&M clothing is more ...","Feb 16, 2021 — Fast-fashion brands, from H&M to Target, are investing in recycling systems in Bangladesh, the second-largest garment manufacturer in the ...",https://www.fastcompany.com/90604447/made-in-bangladesh-may-soon-mean-your-clothing-is-much-more-sustainable?cid=eem524:524:s00:02/21/2021_fc&utm_source=newsletter&utm_medium=Compass&utm_campaign=eem524:524:s00:02/21/2021_fc,67,2022-01-25 05:26:49
Runaway Frenzied Elephant Herd Breaks Into Bangladesh Park,"Jan 2, 2022 — A herd of endangered wild elephants are rampaging through a safari park in Bangladesh, with officials warning Sunday the creatures were ...",https://www.barrons.com/news/runaway-frenzied-elephant-herd-breaks-into-bangladesh-park-01641123907,68,2022-01-25 05:26:49
BBDO expands into Bangladesh | News | Campaign Asia,"Aug 27, 2007 — DHAKA - BBDO has opened its doors for business in Bangladesh through a ... 4 TBWA Asia goes deep into the metaverse with Altava Group win.",https://www.campaignasia.com/article/bbdo-expands-into-bangladesh/203637,69,2022-01-25 05:26:49
Tim Sweeney CEO of Epic Games! by Deconstructor of Fun,"The Economy of the Metaverse | Tim Sweeney CEO of Epic Games! Deconstructor of Fun • By ... Former Apple App Store Head of Games BD, joins the podcast.",https://anchor.fm/deconstructoroffun/episodes/The-Economy-of-the-Metaverse--Tim-Sweeney-CEO-of-Epic-Games-ehar1j,70,2022-01-25 05:26:49
What the metaverse is and how it will work - United News of ...,"Oct 24, 2021 — Cosmos Centre 69/1 New Circular Road, Malibagh, Dhaka-1217,Bangladesh. Email : newsdesk@unb.com.bd.",https://www.unb.com.bd/category/Tech/what-the-metaverse-is-and-how-it-will-work/81091,71,2022-01-25 05:26:49
Convert Metadium to Bangladesh taka - Cryptocurrency ...,"Dec 28, 2021 — Crypto markets are engaged in the transfer of Metaverse Miner into Bangladesh taka. This is a reference to the cryptocurrency exchange rate. 1 ...",https://www.cryptoratesxe.com/convert-metaverse-miner-to-bangladesh-taka.html,72,2022-01-25 05:26:49
মেটাভার্স (Metaverse) যা বদলে দেবে ইন্টারনেটের ভার্চুয়াল ...,বাংলায় মেটাভার্স Metaverse in Bangla — বাংলায় মেটাভার্স Metaverse in Bangla. মেটাভার্সের (Metaverse) ...,https://www.dorbinnews24.com/%E0%A6%AE%E0%A7%87%E0%A6%9F%E0%A6%BE%E0%A6%AD%E0%A6%BE%E0%A6%B0%E0%A7%8D%E0%A6%B8-metaverse-%E0%A6%AF%E0%A6%BE-%E0%A6%AC%E0%A6%A6%E0%A6%B2%E0%A7%87-%E0%A6%A6%E0%A7%87%E0%A6%AC%E0%A7%87-%E0%A6%87/,73,2022-01-25 05:26:49
Facebook Careers | Do the Most Meaningful Work of Your ...,"By leading the development of the metaverse, we ensure people can continue to enjoy state-of-the-art AR effects and VR experiences.",https://www.facebookcareers.com/,74,2022-01-25 05:26:49
Nike buys digital sneaker firm with eye to metaverse | TheHill,"Dec 14, 2021 — Nike Inc. announced it has bought digital sneaker firm RTFKT as the sportswear company looks to build up its presence in the metaverse.",https://thehill.com/policy/technology/585816-nike-buys-digital-sneaker-firm-with-eye-to-metaverse,75,2022-01-25 05:26:49
The Inaugural Metaverse Summit Set to Go Live in ... - EIN News,"6 days ago — The inaugural, two-day Metaverse Summit is set to commence on February 10, 2022 in Decentraland, the world's largest, open-source metaverse.",https://www.einnews.com/pr_news/560925411/the-inaugural-metaverse-summit-set-to-go-live-in-decentraland-in-february,76,2022-01-25 05:26:49
Eyekandy Launches Brand 'MetaStores' for the Metaverse,"5 days ago — Eyekandy represents a one-stop-shop for retailers and brands to test and learn all things metaverse, without having to get into the detail of ...",https://www.galvnews.com/news_ap/business/article_0c7db7d6-560a-5a8e-9d47-ede93fd38965.html,77,2022-01-25 05:26:49
What Is Your Metaverse? - Redmondmag.com,"Dec 8, 2021 — In that announcement, Facebook showed off a number of different metaverse environments, richly rendered in VR. One such environment looked a bit ...",https://redmondmag.com/articles/2021/12/08/welcome-to-the-metaverse-part-1.aspx,78,2022-01-25 05:26:49
Virtual land sales record in Metaverse - Digi Bangla,"Dec 2, 2021 — But day by day it is becoming profitable. In the meantime, Metaverse has set an example by selling virtual land at a record price of 24 lakh 30 ...",https://digibanglatech.news/english/64712/,79,2022-01-25 05:26:49
Rohingya refugees from Myanmar sue Facebook for US$150 ...,"Dec 7, 2021 — Rohingyas face widespread discrimination in Myanmar, with a military-backed campaign seeing hundreds of thousands driven into Bangladesh in 2017.",https://www.scmp.com/news/asia/southeast-asia/article/3158713/rohingya-refugees-myanmar-sue-facebook-us150-billion,80,2022-01-25 05:26:49
